article_id,guid,title,description,category,image,image_caption,image_credit,pub_date,tags,author,source,language,image_name,fetching_time
1eagfsBGLjv0OLjP,https://www.haaretz.co.il/news/weather/2025-09-25/ty-article/00000199-8154-da07-a3dd-e3f7f8cf0000,תחזית מזג האוויר ליום שישי: טמפרטורות מעט נמוכות מהרגיל,"מזג האוויר מחר (שישי) יהיה מעונן חלקית עד בהיר עם עלייה קלה בטמפרטורות, שעדיין יהיו מעט נמוכות מהרגיל. הים התיכון יהיה גלי עד גבה־גלים, גובהו 80–160 סנטימטרים,",חדשות|מזג האוויר,1eagfsBGLjv0OLjP.jpg,"מזג אוויר חורפי בחיפה, היום. צילום: רמי שלוש",haaretz,2025-09-25T17:58:57+03:00,,הארץ,haaretz,he,214968-4,2025-09-25T15:12:05.628179+00:00
-D3uDqktUvPNaeLH,https://www.haaretz.co.il/news/weather/2025-09-25/ty-article/00000199-8154-da07-a3dd-e3f7f8cf0000,תחזית מזג האוויר ליום שישי: טמפרטורות נמוכות מעט מהרגיל,"מזג האוויר מחר (שישי) יהיה מעונן חלקית עד בהיר עם עלייה קלה בטמפרטורות, שעדיין יהיו נמוכות מעט מהרגיל. הים התיכון יהיה גלי עד גבה־גלים, גובהו 80–160 סנטימטרים,",חדשות|מזג האוויר,-D3uDqktUvPNaeLH.jpg,"מזג אוויר חורפי בחיפה, היום. צילום: רמי שלוש",haaretz,2025-09-25T17:58:57+03:00,,הארץ,haaretz,he,214968-4,2025-09-25T18:16:48.677317+00:00
U3R5Zywp5la6E2N_,https://www.haaretz.co.il/magazine/the-edge/2025-09-25/ty-article/.highlight/00000199-813e-d04a-adfd-bd3e68aa0000,"אפילו התאגידים בארה""ב מציבים חללים לשנ""צ. אנחנו לפני מהפכה ביחס לשינה","אחרי שנים שבהן שורת הרווח הכתיבה שעות עבודה אינסופיות, תודעה חדשה מתחילה לצמוח: עובדים דורשים זמן לנוח, והמודל של שמונה שעות שינה בלילה מתערער. האם נועדנו לנמנם?",סוף שבוע|הקצה,U3R5Zywp5la6E2N_.jpg,"שליים. ""ערבים ומוסלמים צעירים מודים לי על כך שאני מדבר עבורם"". צילום: Charlie Bibby/The Financial Times Ltd",haaretz,2025-09-25T17:58:39+03:00,,דורון פייסיק,haaretz,he,sleep,2025-09-25T15:12:05.628269+00:00
rEPg-t1EArXpAvEt,https://www.haaretz.co.il/magazine/2025-09-25/ty-article/.highlight/00000199-812a-dc2d-abfd-cb2fbed50000,"היה לי פעם רעיון לכתיבת ספר, ופתאום הגיבור הזכיר לי את נתניהו וספרטה","איש אחד מאוד קרוב אליי, שאני מכירה מאז שנולדתי, מנסה כבר שנים לשכנע אותי לכתוב רב־מכר בסגנון הרולד רובינס (בסוף המאה הקודמת הוא היה חתום על להיטים שתורגמו בהוצא",סוף שבוע,rEPg-t1EArXpAvEt.jpg,איור,haaretz,2025-09-25T17:41:14+03:00,,נרי ליבנה,haaretz,he,26-9-25-web,2025-09-25T15:12:05.628305+00:00
l9jzeH_4NNS5upLF,https://www.haaretz.co.il/digital/daily/2025-09-25/ty-article/.premium/00000199-8122-db6e-a5d9-d76e59c70000,"את המחיר על תבוסת נתניהו משלמים כולנו, חוץ ממנו ומסייעניו","נתניהו טס לאו""ם בדרכו העקמומית אבל הוא לא ייצג שם את ישראל. וגם: הגשם מנסה לשטוף את הכאב, אורי משגב נגעל מההילולה באומן, סיכום שנה גבוה וטוב וסיור בעקבות הפרח המרגש ביותר בישראל - החצב | היום ביומית",דיגיטל|היומית,l9jzeH_4NNS5upLF.jpg,"עבאס בנאום המשודר באו""ם, היום. צילום: Richard Drew/אי־פי",haaretz,2025-09-25T17:32:35+03:00,,מורן שריר,haaretz,he,218314,2025-09-25T15:12:05.628338+00:00
iaNqmnwBzao6xrd5,https://www.haaretz.co.il/digital/daily/2025-09-25/ty-article/.premium/00000199-8122-db6e-a5d9-d76e59c70000,"נתניהו טס לאו""ם בדרכו העקמומית, אבל הוא לא ייצג שם את ישראל","את המחיר על תבוסת נתניהו משלמים כולנו, חוץ ממנו ומסייעניו. וגם: הגשם מנסה לשטוף את הכאב, אורי משגב נגעל מההילולה באומן, סיכום שנה גבוה וטוב וסיור בעקבות הפרח המרגש ביותר בישראל - החצב | היום ביומית",דיגיטל|היומית,iaNqmnwBzao6xrd5.jpg,"נתניהו בנתב""ג, הלילה. אדם שלא חי בישראל כבר שנים. צילום: אבי אוחיון / לעמ",haaretz,2025-09-25T17:32:35+03:00,,מורן שריר,haaretz,he,218314,2025-09-25T18:16:48.677390+00:00
BZ58WlBYCj8rr8ck,https://www.haaretz.co.il/news/politics/2025-09-25/ty-article/00000199-811a-d04a-adfd-bd1a9f5d0000,ספרד ביטלה עסקה שלישית לרכישת אמצעי לחימה מישראל,"העסקה, בשווי 207 מיליון אירו, נחתמה עם חברת רפאל לרכישת מכלי נשיאה מתקדמים לניווט ולתקיפה למטוסי היורופייטר טייפון של ספרד. אתמול נכנס לתוקפו חוק בספרד המטיל אמברגו על ישראל במסגרת החרפת הצעדים נגדה",חדשות|מדיני ביטחוני,BZ58WlBYCj8rr8ck.jpg,"מטוס יורופייטר טייפון גרמני נושא פוד של חברת רפאל, בחודש אוגוסט. צילום: Bundeswehr-Stefan Petersen",haaretz,2025-09-25T17:19:07+03:00,,עודד ירון,haaretz,he,842362,2025-09-25T15:12:05.628367+00:00
JzTwqC7d9RvljZ5X,https://www.haaretz.co.il/magazine/underthesun/2025-09-25/ty-article/.highlight/00000199-7ddb-db6e-a5d9-ffffe4180000,הדת היא לא הבעיה שלנו. היא הפתרון למשבר הגדול של הדמוקרטיה,"גם בעולם ליברלי ומתקדם, אי אפשר לקיים חברה סבירה בלי אמונה. הציניות והריקנות שמובילים מאסק ודומיו הן שהובילו את העולם למשבר החמור שהוא נמצא בו - והדרך של האנושות להיחלץ מהאפלה היא רק באמצעות דת חדשה",סוף שבוע|תחת השמש,JzTwqC7d9RvljZ5X.jpg,"שליים. ""ערבים ומוסלמים צעירים מודים לי על כך שאני מדבר עבורם"". צילום: Charlie Bibby/The Financial Times Ltd",haaretz,2025-09-25T17:16:47+03:00,,עפרי אילני,haaretz,he,165904,2025-09-25T15:12:05.628395+00:00
ZwSdNxB_DbI5jvgF,https://www.haaretz.co.il/news/politics/2025-09-25/ty-article/.premium/00000199-8127-daea-adff-bfe728990000,"עבאס בנאום משודר באו""ם: מוכנים לאחריות מלאה על הרצועה, לחמאס לא יהיה תפקיד","נשיא הרשות הפלסטינית הוסיף כי אינו רוצה מדינה חמושה. ""חמאס והפלגים האחרים יצטרכו למסור את הנשק שלהם"", אמר בנאום שנשא מרחוק, לאחר שכניסתו לארה""ב נאסרה על ידי ממשל טראמפ",חדשות|מדיני ביטחוני,ZwSdNxB_DbI5jvgF.jpg,"עבאס נואם באו""ם, הערב. צילום: Richard Drew/אי־פי",haaretz,2025-09-25T17:02:47+03:00,,ליזה רוזובסקי,haaretz,he,218524,2025-09-25T15:12:05.628425+00:00
issthSXMe6gI7Tpb,https://www.haaretz.co.il/wellbeing/health-blogs/psychology/amaliarosenblum/2025-09-25/ty-article-magazine/00000199-669a-daaf-a79f-effe8edc0000,"מה השמאל יכול ללמוד מטראמפ ונתניהו על ""אלגוריתם הכריזמה""?","כריזמה היא לא קסם מולד אלא נוסחה פסיכולוגית. טראמפ ונתניהו יודעים להפעיל אותה. עכשיו נותר לשמאל למצוא מנהיג שיפנה לרגש, ולא רק להיגיון הקר",לחיות נכון|תיאוריית הקשר,issthSXMe6gI7Tpb.jpg,דונלד טראמפ. מדוע הוא נתפש ככריזמטי למרות החסך במדדי החום והכישורים?. צילום: TANNEN MAURY / AFP,haaretz,2025-09-25T17:00:31+03:00,,עמליה רוזנבלום,haaretz,he,267440,2025-09-25T15:12:05.628490+00:00
oCOc1hjOQRl_QvuU,https://www.haaretz.co.il/gallery/fashion/2025-09-25/ty-article/.premium/00000199-8122-dc2d-abfd-cb27ed2a0000,"הזוג נתניהו המריא לעצרת האו""ם בלבוש של צבעי הדגל הפלסטיני","בעוד שנתניהו הצהיר לפני טיסתו על רצינות כוונותיו, בחירות הלבוש שלו ושל רעייתו סיפרו סיפור שונה",תרבות|אופנה,oCOc1hjOQRl_QvuU.png,"ראש הממשלה נתניהו ורעייתו שרה לפני המראתם לארצות הברית, הבוקר. צילום: צילום מסך לע""מ",haaretz,2025-09-25T16:57:31+03:00,,אופיר חובב,haaretz,he,untitled,2025-09-25T15:12:05.628534+00:00
G4IBrvC7T24s7J7a,https://www.haaretz.co.il/gallery/cinema/movie-reviews/2025-09-25/ty-article-review/.premium/00000199-80ef-daea-adff-bfefe1320000,"""מסע גדול אמיץ ויפה"": סרט שאפשר להגיד עליו ""מיוחד"" או ""תמהוני""","""מסע גדול אמיץ ויפה"" מדבר על לקיחת צ'אנסים באהבה, אבל כמעט לא לוקח סיכונים בעצמו. הכימיה בין מרגו רובי לקולין פארל ניכרת — אבל לא מספיקה",תרבות|ביקורת סרטים,G4IBrvC7T24s7J7a.jpg,"בנימין נתניהו, מתוך הפרק החמישי של ""סאות' פארק"". ""אל תגלגל לי עיניים!"". צילום: צילוך מסך מתוך comedy central",haaretz,2025-09-25T16:53:04+03:00,,אורון שמיר,haaretz,he,63181103,2025-09-25T15:12:05.628565+00:00
AkPtba71PirxN4ag,https://www.haaretz.co.il/opinions/2025-09-25/ty-article-opinion/.premium/00000199-80f9-d27b-affd-def977230000,"הנשיא מקרון, לפלסטינים מגיע יותר. לא מחוות סמליות ומנהיגים סרבנים","כשנשיא צרפת עמנואל מקרון התראיין לערוץ 12 הישראלי, הוא הכריז שמינוי סגן נשיא ברשות הפלסטינית מהווה רפורמה מספיקה, שמצדיקה את הכרת צרפת במדינה פלסטינית. במילים ה",דעות,AkPtba71PirxN4ag.jpg,תיעוד התקיפה בצנעא.,haaretz,2025-09-25T16:47:08+03:00,,סאמר סינג'ילאווי,haaretz,he,198797,2025-09-25T15:12:05.628593+00:00
jSeG5hldhiUbIyqT,https://www.haaretz.co.il/news/politics/2025-09-25/ty-article/00000199-80ea-df94-a1bb-faee95cb0000,ממשלת סלובניה הכריזה על ראש הממשלה נתניהו כאישיות בלתי־רצויה,סלובניה היא המדינה הראשונה שאוסרת על נתניהו להיכנס לשטחה. משרד החוץ הסביר כי ההחלטה התקבלה בעקבות ההליכים שנפתחו נגדו בחשד לפשעי מלחמה. הממשלה החליטה בנוסף לתרום 1.2 מיליון אירו לרשות הפלסטינית במסגרת יוזמה אירופאית־סעודית למניעת קריסתה הכלכלית,חדשות|מדיני ביטחוני,jSeG5hldhiUbIyqT.jpg,"נתניהו בלשכתו, בשבוע שעבר. ממשלת סלובניה הסבירה כי מטרתה היא להעביר מסר ברור לממשלת ישראל, שסלובניה מצפה ממנה שתכבד באופן עקבי החלטות של בתי הדין הבינלאומיים. צילום: מעיין טואף, לע""מ",haaretz,2025-09-25T16:45:21+03:00,,ליזה רוזובסקי,haaretz,he,107532,2025-09-25T15:12:05.628620+00:00
qYfXjaJp6pvAIRRa,https://www.haaretz.co.il/news/politics/2025-09-25/ty-article/00000199-80ea-df94-a1bb-faee95cb0000,ממשלת סלובניה הכריזה על ראש הממשלה נתניהו שהוא אישיות לא רצויה,סלובניה היא המדינה הראשונה שאוסרת על נתניהו להיכנס לתחומה. משרד החוץ הסביר כי ההחלטה התקבלה בעקבות ההליכים שנפתחו נגדו בחשד לפשעי מלחמה. הממשלה החליטה בנוסף לתרום 1.2 מיליון אירו לרשות הפלסטינית במסגרת יוזמה אירופאית־סעודית למניעת קריסתה הכלכלית,חדשות|מדיני ביטחוני,qYfXjaJp6pvAIRRa.jpg,"נתניהו בלשכתו, בשבוע שעבר. ממשלת סלובניה הסבירה כי מטרתה היא להעביר מסר ברור לממשלת ישראל, שסלובניה מצפה ממנה שתכבד בעקביות החלטות של בתי הדין הבינלאומיים. צילום: מעיין טואף, לע""מ",haaretz,2025-09-25T16:45:21+03:00,,ליזה רוזובסקי,haaretz,he,107532,2025-09-25T18:16:48.677650+00:00
R2fN4ZUN1pV5x2zu,https://www.haaretz.co.il/news/politics/2025-09-25/ty-article/00000199-8107-daea-adff-bfe751b10000,"לאחר פגיעת הכטב""ם באילת, ישראל תקפה יעדים של החותים בצנעא","צה""ל מסר כי תקף בין היתר את מפקדת השליטה של המטכ""ל החותי, מחנות צבאיים ופעילים חותים. לפי שר הביטחון כץ, התקיפה בוצעה בתגובה על פגיעת הכטב""ם אתמול באילת. ""מי שפוגע בנו ייפגע שבעתיים"", אמר",חדשות|מדיני ביטחוני,R2fN4ZUN1pV5x2zu.jpeg,"עשן מיתמר בצנעא לאחר תקיפה ישראלית, היום.",haaretz,2025-09-25T16:23:15+03:00,,יניב קובוביץ,haaretz,he,whatsapp-image-2025-09-25-at-16-31-01,2025-09-25T15:12:05.628646+00:00
11m4oOxHmnrtQihe,https://www.haaretz.co.il/news/world/middle-east/2025-09-25/ty-article/00000199-80d6-db6e-a5d9-d6fe0b420000,צילומי לוויין מראים: ייתכן שאיראן הסתירה ניסוי בטיל בליסטי שביצעה בשבוע שעבר,"חבר פרלמנט איראני טען כי מדובר בניסוי בטיל בליסטי בין-יבשתי. הניסוי מעלה חשש שטהראן מנסה להרחיב את טווח הטילים שלה, בשעה שהמתיחות בינה לבין המערב נותרת גבוהה לקראת כניסתן האפשרית לתוקף של סנקציות האו""ם",חדשות|המזרח התיכון,11m4oOxHmnrtQihe.jpg,"סימני החריכה על כן השיגור בבסיס החלל אימאם חומייני, אתמול. צילום: Planet Labs PBC/אי־פי",haaretz,2025-09-25T16:16:18+03:00,,אי־פי,haaretz,he,217154,2025-09-25T15:12:05.628671+00:00
8699nd3PLyhydpn0,https://www.haaretz.co.il/gallery/television/2025-09-25/ty-article/.premium/00000199-7101-d04a-adfd-7d010c740000,סרטי השבוע בטלוויזיה,החל מ-26.9,תרבות|טלוויזיה,8699nd3PLyhydpn0.jpg,בילי סגל־גזליוס והכלבה שוגי בארכיון של רשות השידור. שומרת סף של רגעים היסטוריים. צילום: אוליבייה פיטוסי,haaretz,2025-09-25T16:00:42+03:00,,אורון שמיר,haaretz,he,949636,2025-09-25T15:12:05.628697+00:00
YyrV_891dW9h6c8i,https://www.haaretz.co.il/food/2025-09-25/ty-article-magazine/.premium/00000198-bd0f-d658-ad9c-ff5f15570000,האם תפריט מים הוא הדבר הגדול הבא בעולם המסעדות?,"אחרי שנים של מיתוג כגימיק, עולם המים מתייצב בקדמת הבמה עם תפריטים רחבים במסעדות. התכוננו בקרוב לשאלות: מי קרחונים בני אלפי שנים או מים מוגזים טבעית ממעיינות? מים בעלי מליחות מעודנת או מתוקים? מים שיתאימו ליין לבן או אדום?",אוכל,YyrV_891dW9h6c8i.jpg,כוס מים. הכל אותו טעם? לא לפי מומחי המים. צילום: Cozine / Shutterstock.com,haaretz,2025-09-25T15:31:39+03:00,,איתן לשם,haaretz,he,02678-2,2025-09-25T15:12:05.628719+00:00
15m7xZcZa2GVHEKi,https://www.haaretz.co.il/travel/travel-europe/switzerland/2025-09-25/ty-article-magazine/.premium/00000199-666e-de72-a7fd-6eef72a60000,לפעמים המילים נגמרות: טיול סתווי במרכז שווייץ,"פסגות דרמטיות מכוסות בקרחוני עד, עמקים ירוקים, אגמים בצבע טורקיז, עיירות מטופחות ורכבות שמגיעות בזמן ומחברות ביעילות גם את הפינות הנידחות ביותר. הצעה לטיול סתווי במרכז שווייץ, אחרי שתיירי הקיץ עזבו וגולשי הסקי עוד לא הגיעו",טיולים|שוויץ,15m7xZcZa2GVHEKi.jpg,"הלוויתו של בוזגלו, היום. רעייתו: ""זה קורע לי את הלב שמשהו הצליח להפריד בינינו"". צילום: גיל אליהו",haaretz,2025-09-25T15:27:52+03:00,,רותם בר כהן,haaretz,he,216682,2025-09-25T15:12:05.628744+00:00
qAGH1tVLW0OSbn-8,https://www.haaretz.co.il/family/talmaorzingerman/2025-09-25/ty-article-magazine/.premium/00000199-5ce7-de72-a7fd-7ce7ae1f0000,"ילדים צריכים ללכת יחפים בגינה, לחפור באדמה, להירטב בגשם","תמונות וספרים על טבע זה נחמד, אבל ילדים צריכים להכיר טבע דרך גופם. כך תאפשרו להם הזדמנויות למידה",משפחה|הורות מונטסורית,qAGH1tVLW0OSbn-8.jpg,"חשוב לחשוף את הילדים למזג האוויר באזור המגורים, במיוחד כשיש שינויים. איור: הגר ורטהים",haaretz,2025-09-25T15:18:39+03:00,,טל מאור זינגרמן,haaretz,he,123345,2025-09-25T15:12:05.628771+00:00
2M8YYbp_PouLap4k,https://www.haaretz.co.il/sport/world-soccer/2025-09-25/ty-article/00000199-808d-d49d-a9d9-c7cf15020000,"דיווח: אופ""א תצביע בשבוע הבא על השעיית ישראל; ארה""ב: פועלים למנוע את המהלך","בעקבות קריאות של מומחי האו""ם להשעות את ישראל בשל המלחמה בעזה, פיפ""א ואופ""א בוחנות את הסוגיה. לפי דיווח בסקיי משרד החוץ האמריקאי אמר כי יבלום כל ניסיון להרחיק את הנבחרת, בעוד בטיימס דווח כי אופ""א תצביע על המהלך בשבוע הבא",ספורט|כדורגל בעולם,2M8YYbp_PouLap4k.jpg,"אחד מהשלטים של אוהדי פאוק סלוניקי, אתמול. מכבי תל אביב עשויה לסיים את דרכה בליגה האירופית מוקדם מהצפוי. צילום: Giannis Papanikos/אי־פי",haaretz,2025-09-25T14:30:18+03:00,,ספורט הארץ,haaretz,he,209105,2025-09-25T12:19:39.260964+00:00
GemrPZ4IeAZwX9nn,https://www.haaretz.co.il/sport/world-soccer/2025-09-25/ty-article/00000199-808d-d49d-a9d9-c7cf15020000,"דיווח: אופ""א תצביע בשבוע הבא על השעיית ישראל, רוב החברות תומכות; ארה""ב פועלת למניעת המהלך","בעקבות קריאות של מומחי האו""ם להשעות את ישראל בשל המלחמה בעזה, פיפ""א ואופ""א בוחנות את הסוגיה. לפי דיווח בסקיי משרד החוץ האמריקאי אמר כי יבלום כל ניסיון להרחיק את הנבחרת, בעוד בטיימס דווח כי אופ""א תצביע על המהלך בשבוע הבא",ספורט|כדורגל בעולם,GemrPZ4IeAZwX9nn.jpg,"אחד מהשלטים של אוהדי פאוק סלוניקי, אתמול. מכבי תל אביב עשויה לסיים את דרכה בליגה האירופית מוקדם מהצפוי. צילום: Giannis Papanikos/אי־פי",haaretz,2025-09-25T14:30:18+03:00,,ספורט הארץ,haaretz,he,209105,2025-09-25T15:12:05.628797+00:00
phzUKdx92yyeA9mn,https://www.haaretz.co.il/blogs/roibetlevi/2025-09-25/ty-article/00000199-7fa6-daea-adff-7fe7bce30000,מבריכות חורף עד גגות ירוקים: פיסות טבע עירוני אינן מותרות אלא תשתית לקיום אנושי,"פתרונות מבוססי טבע שמשתלבים בתכנון עירוני ממתנים את נזקי האורבניזציה, ומסייעים לערים להתמודד עם אירועי מזג אוויר קיצוניים",בלוגים|ריאה ירוקה,phzUKdx92yyeA9mn.jpeg,בריכת החורף בחולון. אתר הטבע הראשון בישראל שעבר פירוא (rewilding) - שיקום של בית גידול טבעי שנהרס עקב פעילות אנושית. צילום: ליאב שלם,haaretz,2025-09-25T14:28:00+03:00,,"זווית, סוכנות ידיעות למדע וסביבה",haaretz,he,holon,2025-09-25T12:19:39.261055+00:00
JYQoHfXi14xdfaV-,https://www.haaretz.co.il/news/politics/2025-09-25/ty-article/00000199-8074-db6e-a5d9-d67c5dd90000,"""נפלת בקרב שנמשך יותר מדי זמן"": שחר בוזגלו וצ'אלצ'או שמעון דמלאש מובאים למנוחות","רעייתו של בוזגלו, שנהרג ביום שני בעיר עזה מירי טיל נ""ט, נפרדה ממנו ואמרה: ""אחרי תקופה ארוכה הצלחנו להיכנס להיריון. השארת לי את המתנה הכי גדולה בחיים. שובר לי את הלב שהוא לא יתחנך על ברכיך"". מפקדו של דמאלש: ""אני רוצה שכולם ידעו, היית גיבור אמיתי""",חדשות|מדיני ביטחוני,JYQoHfXi14xdfaV-.jpg,"הלוויתו של בוזגלו, היום. רעייתו: ""זה קורע לי את הלב שמשהו הצליח להפריד בינינו"". צילום: גיל אליהו",haaretz,2025-09-25T14:24:48+03:00,,עדי חשמונאי,haaretz,he,img-20250925-wa0044,2025-09-25T12:19:39.261095+00:00
cbnyOM2NKvJwcTic,https://www.haaretz.co.il/news/politics/2025-09-25/ty-article/00000199-8074-db6e-a5d9-d67c5dd90000,"""הלב שלי שבור, לעולם לא אהיה שלמה"": שחר בוזגלו וצ'אלצ'או שמעון דמלאש הובאו למנוחות","רעייתו של בוזגלו, שנהרג ביום שני בעיר עזה מירי טיל נ""ט, נפרדה ממנו ואמרה: ""אחרי תקופה ארוכה הצלחנו להיכנס להיריון. השארת לי את המתנה הכי גדולה בחיים. שובר לי את הלב שהוא לא יתחנך על ברכיך"". מפקדו של דמלאש: ""אני רוצה שכולם ידעו, היית גיבור אמיתי""",חדשות|מדיני ביטחוני,cbnyOM2NKvJwcTic.jpg,"הלווייתו של בוזגלו במגדל העמק, היום. רעייתו: ""זה קורע לי את הלב שמשהו הצליח להפריד בינינו"". צילום: גיל אליהו",haaretz,2025-09-25T14:24:48+03:00,,עדי חשמונאי,haaretz,he,217329-2,2025-09-25T15:12:05.628849+00:00
Fd31IMYoyzpCrk8p,https://www.haaretz.co.il/digital/podcast/2025-09-25/ty-article-podcast/00000199-804b-d04a-adfd-bd4b36f80000,מה אתם יודעים על ספרטה ואתונה ומי היתה טובה יותר? רמז: לא מי שחשבתם,"השבוע ב""חוץ לארץ"" עם חן ליברמן:","חוץ לארץ|בראש החדשות:|בנאומו באו""ם טראמפ אימץ את המסר הישראלי והמחיש את הפרדוקס הפלסטיני|צעירה כבת 20 נורתה מרכב חולף סמוך לשדרות, מצבה אנוש|""מבחינת רה""מ שיישבו מיליון בכיכר החטופים ויתבכיינו. זה בסדר גמור""""מבחינת רה""מ שיישבו מיליון בכיכר החטופים ויתבכיינו. זה בסדר גמור עבורו""|טיסת כנף ציון לארה""ב הוארכה ביותר מ־600 ק""מ כדי לא לעבור מעל אירופה|המקום הזה לא מוכר אוכל, אלא ציפייה לאוכל. התור הוא המהות|איך לבחור את הקפה שאני אוהב?|בבליל השקרים של טראמפ על משבר האקלים היתה אמת אחת שמחדדת את האסוןבתוך בליל השקרים של טראמפ על משבר האקלים הייתה אמת אחת שמחדדת את האסון|מבודד מתמיד, נתניהו ינסה לשכנע את טראמפ להקשיב דווקא לו ולחכות לניצחון|""בעלת המועדון אמרה 'אם אתן רוצות להופיע תצלמו סרטון נגד רצח העם בעזה'""|הטלסקופ שלוקח את האנושות לראשית היקום מספק טרפת של תגליות. תמונת מצב|טראמפ הודה שהעולם מורכב ממה שחשב. מוקדם לקבוע אם אכן התפכח|מסע בין תחנות חייה הצנועים והסוערים של אחת המשוררות החשובות במאה ה-20|מדורים|כלים שימושיים|Haaretz|TheMarker|שיתופי פעולה",Fd31IMYoyzpCrk8p.jpg,פסל של ליאונידס. צילום: Pit Stock / Shutterstock.com,haaretz,2025-09-25T14:06:48+03:00,,חוץ לארץ,haaretz,he,plgr,2025-09-25T12:19:39.261128+00:00
