article_id,guid,title,description,category,image,image_caption,image_credit,pub_date,tags,author,source,language,image_name,fetching_time
qj1C5aQ9gYZo8ZB5,https://www.haaretz.co.il/food/2025-09-28/ty-article-magazine/.premium/00000199-5c10-d0dc-afdb-deb72c550000,"ריה: בית יין חדש של עדן שרייר דור, ה""בת של ננוצ'קה""","עם 32 שקל לכוס יין מהיקב המשפחתי ההולך ונבנה, עדן שרייר דור מנסה להרגיל את צרכני הבירה של עמק הירדן ליין טוב. בדרך לשם היא לא מהססת להכניס יין אדום למקרר, ולא מתגעגעת לעיר הגדולה",אוכל,qj1C5aQ9gYZo8ZB5.jpg,"עדן שרייר דור. ""תל אביב ירדה מהפרק אצלי"". צילום: באדיבות המצולמת",haaretz,2025-09-28T11:58:35+03:00,,איתן לשם,haaretz,he,29ea922a-e065-4d5f-ba28-8ac4809c66a1,2025-09-28T09:04:04.839020+00:00
LF6jl5cMzRSEHk_z,https://www.haaretz.co.il/gallery/gaming/2025-09-28/ty-article-review/.premium/00000199-8f65-daea-adff-bfe7efb30000,Mafia: The Old Country: תחליטו למי להיות נאמנים,"The Old Country, המשחק החדש בסדרת ""מאפיה"", מתחמק מהקלישאות הוויזואליות אבל נופל לאחרות. אם אתם לא מחפשים משהו קצת יותר עמוק, זו הצעה שאי אפשר לסרב לה",תרבות|גיימינג,LF6jl5cMzRSEHk_z.jpg,איור: לי-אור עצמון פרואין,haaretz,2025-09-28T11:33:19+03:00,,עודד פוירשטיין,haaretz,he,63209179,2025-09-28T09:04:04.839113+00:00
PhZidQjKDSOiFBCi,https://www.haaretz.co.il/news/world/america/2025-09-28/ty-article/.premium/00000199-8f33-d772-a59f-8f77a66d0000,"טראמפ שולח חיילים לפורטלנד ""הנתונה במלחמה"" כדי להגן על מתקנים של סוכנות ההגירה - ומואשם בשקרים","מושלת אורגון וראש העיר של פורטלנד דחו את דברי הנשיא האמריקאי וטענו שאין בעיר איום ביטחוני או אנרכיה, ושהמחאה מול מתקן ICE קטנה ושקטה. סנאטור דמוקרטי מאורגון: ""הנשיא שלח לכאן סוכנים כדי ליצור כאוס ומהומות""",חדשות|אמריקה,PhZidQjKDSOiFBCi.jpg,"השליח ויטקוף והנשיא טראמפ בניו־יורק, בתחילת החודש. צילום: Evelyn Hockstein/רויטרס",haaretz,2025-09-28T11:23:45+03:00,,גרדיאן,haaretz,he,243144,2025-09-28T09:04:04.839152+00:00
wYA7v7rEFo5hpOqB,https://www.haaretz.co.il/news/law/2025-09-28/ty-article/.premium/00000199-8ef3-dbe0-af9d-9ef336480000,"מפגין שכרז שמות חטופים מול ביתו של אוחנה נעצר בפעם השביעית, שוטרים ניסו לפרוץ לרכבו","בית המשפט קבע בשבוע שעבר במקרה דומה כי ניסיון של שוטרים לפרוץ לרכב של מפגין היווה ""התנהלות בעייתית"". המשטרה טענה כי לוי פעל בניגוד להחלטת בג""ץ כשחצה את הגבול המותר למחאה רועשת, אך לוי טען שלא ניתן לעצור אותו בלי צו בית משפט מפני שכרז מתוך הרכב שלו",חדשות|משפט ופלילים,wYA7v7rEFo5hpOqB.jpg,"טראמפ ונתניהו בבית הלבן, בפברואר. הפגישה עשויה להטות את הספינה בכיוון סיום המלחמה. צילום: Evan Vucci/אי־פי",haaretz,2025-09-28T10:55:45+03:00,,בר פלג,haaretz,he,265359-2,2025-09-28T09:04:04.839187+00:00
VP_46IWMVpGhdZkF,https://www.haaretz.co.il/news/politics/2025-09-28/ty-article/00000199-8f30-d27b-affd-dfb0e5190000,"בניגוד לעמדת גורמי המקצוע, הוועדה לביטחון לאומי דנה בהצעת חוק עונש מוות למחבלים","יו""ר הוועדה פוגל התייחס להתנגדויות של גורמי המקצוע להצעת החוק ואמר כי החליט שלא לקבל את הערכת המצב שלהם. הוא גם דחה את התנגדותו של מתאם השבויים והנעדרים הירש שאמר בוועדה: זו סכנת נפשות. יש לנו עוד 48 חטופים להשיב, הדיון הזה לא עוזר לנו",חדשות|מדיני ביטחוני,VP_46IWMVpGhdZkF.jpg,"הירש בוועדה, הבוקר. ""באתי לכאן לבקש שהדיון לא יתקיים, אני צריך לעמוד במשימת השבת החטופים"". צילום: אורן בן חקון",haaretz,2025-09-28T10:42:41+03:00,,נעה שפיגל,haaretz,he,img-20250928-wa0028,2025-09-28T09:04:04.839220+00:00
G4xBdP3lEyjJ5_7m,https://www.haaretz.co.il/news/politics/2025-09-28/ty-article/.premium/00000199-8d6c-d27b-affd-dffcce8a0000,"הרוח בוושינגטון שינתה כיוון, ונתניהו ייאלץ להתמודד עם הלחץ לסיים את המלחמה","ראש הממשלה ימריא מחר לביקורו הרביעי השנה בבית הלבן, וידון עם טראמפ בתוכנית ""21 הנקודות"" שלו. נראה שהפעם, לפחות בצד הישראלי, עלילת המחזה רחוקה מלהיות כתובה מראש",חדשות|מדיני ביטחוני,G4xBdP3lEyjJ5_7m.jpg,"טראמפ ונתניהו בבית הלבן, בפברואר. הפגישה עשויה להטות את הספינה בכיוון סיום המלחמה. צילום: Evan Vucci/אי־פי",haaretz,2025-09-28T10:33:41+03:00,,ליזה רוזובסקי,haaretz,he,203764,2025-09-28T09:04:04.839251+00:00
JSKCHK8UWL1fhCgA,https://www.haaretz.co.il/news/law/2025-09-28/ty-article/.premium/00000199-8f2e-daea-adff-bfef8b050000,"בית המשפט גזר 12 עד 14 שנות מאסר על שבעת מבצעי הלינץ' ביגאל יהושע במהלך ""שומר החומות""","השבעה הורשעו בחבלה בכוונה מחמירה במסגרת הסדר טיעון שבו הודו במיוחס להם, ובית המשפט קבע כי המניע למעשה היה לאומני ובנסיבות של מעשה טרור. נגזרו גם שלוש שנות מאסר על אדם שמיני ששיבש את חקירת הלינץ' והשליך במסגרתו אבנים, אך לא על יהושע",חדשות|משפט ופלילים,JSKCHK8UWL1fhCgA.jpg,"טראמפ ונתניהו בבית הלבן, בפברואר. הפגישה עשויה להטות את הספינה בכיוון סיום המלחמה. צילום: Evan Vucci/אי־פי",haaretz,2025-09-28T10:19:06+03:00,,יהושע (ג'וש) בריינר,haaretz,he,254390-1,2025-09-28T09:04:04.839282+00:00
jzH7vjfvRq1qfxxw,https://www.haaretz.co.il/nature/2025-09-28/ty-article/.premium/00000199-8ee4-daea-adff-bfe799f50000,"הצעת חוק מבקשת להסדיר את הטיפול בפסולת בניין, אך האם היא מטפלת בכל הבעיה?","במהלך דיון שהתקיים בכנסת הוצגו עקרונות החוק המתגבש, ובמרכזם העיקרון לפי התשלום עבור הפינוי יתבצע למנגנון ממשלתי והעברת הכסף למפנה הפסולת תיעשה רק לאחר שיתקבל אישור שהפינוי נעשה לאתר חוקי",סביבה ואקלים,jzH7vjfvRq1qfxxw.jpg,132457,haaretz,2025-09-28T10:09:54+03:00,,צפריר רינת,haaretz,he,512416,2025-09-28T09:04:04.839327+00:00
PiGnnCPwrEF_kX3J,https://www.haaretz.co.il/food/salads/2025-09-28/ty-article-magazine/0000017f-e535-d9aa-afff-fd7d08160000,30 דרכים להכין סלטים עם סלק,"טרי, מבושל או צלוי: בין אם בתפקיד הראשי ובין אם בתפקיד המשני - הסלק הוא תוספת מרעננת, פריכה ומתקתקה, צבעונית ופשוט טעימה לכל סלט",אוכל|סלטים וירקות,PiGnnCPwrEF_kX3J.jpg,סלט סלק. צילום: אנטולי מיכאלו,haaretz,2025-09-28T09:54:00+03:00,,רותם מימון,haaretz,he,1206909438,2025-09-28T09:04:04.839364+00:00
6v8pT8RSVGHBctdW,https://www.haaretz.co.il/news/world/america/2025-09-28/ty-article-magazine/.premium/00000199-8eeb-d27b-affd-defb00540000,ארגון פשיעה בארגנטינה העביר בשידור חי ברשתות חברתיות עינויים ורצח של שתי נשים ונערה,"עשרות אלפי בני אדם הפגינו בבואנוס איירס בעקבות הפשע המזעזע שבו פותו שתי בנות דודות בגיל 20 ובת 15 לנסיעה ברכב מסחרי, הוסעו לבית בפרברי העיר, שם עונו ונרצחו לעיני מצלמות. במהלך השידור נשמע אחד מראשי כנופיית מבריחי הסמים אומר: ""זה מה שקורה למי שגונב לי סמים""",חדשות|אמריקה,6v8pT8RSVGHBctdW.jpg,"מפגינים בבואנוס איירס מוחים על רצח שלוש הנשים, ברנדה דל קסטיו, מורנה ורדי ולארה גוטיירס, אתמול. צילום: Gustavo Garello/אי־פי",haaretz,2025-09-28T09:45:45+03:00,,ניו יורק טיימס,haaretz,he,248191,2025-09-28T09:04:04.839391+00:00
5FbrLKBcaWZFVVD4,https://www.haaretz.co.il/health/brain/2025-09-28/ty-article-magazine/.premium/00000199-8071-d27b-affd-def139470000,"למה אנחנו לא מפסיקים לאכול גם כשאנחנו שבעים? מחקר חדש חושף את ""כפתור החשק""","מחקר חדש מצא שמעגל עצבי מסוים עוקף את תחושת השובע וגורם לנו להמשיך באכילת מתוקים גם אחרי ארוחה מלאה. מחקר נוסף שכלל את הבנת ""מעגל הדופמין"" שמניע אכילה כפייתית. שניהם עשויים לסייע בדרכים חדשות להתמודדות עם מגפת ההשמנה וגם לטפל בחוסר תיאבון הנגרם ממחלות",בריאות|שטיפת מוח,5FbrLKBcaWZFVVD4.jpg,132457,haaretz,2025-09-28T09:43:36+03:00,,איתי עניאל,haaretz,he,216794,2025-09-28T09:04:04.839420+00:00
FFeW9Ps9gnlkC5ro,https://www.haaretz.co.il/food/soups/2025-09-28/ty-article-recipe/00000199-8c47-daea-adff-bfe7eed70000,מרק עוף עם כרישה ולימון,"מרק עוף בהשראה יוונית־סקוטית, עם כרישה ואורז, שמתחיל בציר עשיר ומסתיים בנגיעת ביצה ולימון עדינה שמעניקה לו מרקם קטיפתי ורעננות מפתיעה",אוכל|מרקים,FFeW9Ps9gnlkC5ro.jpg,"מרק עוף עם כרישה, אורז ולימון. בהשפעה יוונית וסקוטית. צילום: Andrew Scrivani for The New York",haaretz,2025-09-28T08:53:30+03:00,,ניו יורק טיימס,haaretz,he,well-leeks-soup-may25-0,2025-09-28T06:14:39.633655+00:00
DJEnWgdIi0KWN36Z,https://www.haaretz.co.il/sport/news/2025-09-28/ty-article-live/00000199-8ec0-d27b-affd-ded0d6000000,"חדשות ספורט, 28 בספטמבר",לאמין ימאל התאושש מהפציעה ויחזור לסגל ברצלונה לקראת המשחק מול סוסיאדד,ספורט|חדשות ספורט,,,haaretz,2025-09-28T08:17:30+03:00,,"כתבי ספורט ""הארץ""",haaretz,he,,2025-09-28T06:14:39.633735+00:00
pS5yg49JE1oDOCNY,https://www.haaretz.co.il/news/politics/2025-09-28/ty-article/.premium/00000199-8e89-dbe0-af9d-9ee9d9f80000,דיווח: תוכנית טראמפ לעסקת חטופים כוללת השמדה של הנשק ההתקפי של חמאס,"בוושינגטון פוסט דווח כי בתוך 48 שעות מתחילת הפסקת האש ישוחררו כל החטופים החיים ""ויותר מ־24 גופות של חטופים"". ברצועה מוחזקים 26 חטופים שנקבע מותם ועוד שניים שקיים חשש כבד לחייהם",חדשות|מדיני ביטחוני,pS5yg49JE1oDOCNY.jpg,"מפגינים למען החטופים בתל אביב, אתמול. לפי הדיווח, המתווה האמריקאי כולל שחרור של כל החטופים החיים בתוך 48 שעות מתחילת הפסקת האש. צילום: איתי רון",haaretz,2025-09-28T07:55:42+03:00,,הארץ,haaretz,he,245822,2025-09-28T06:14:39.633770+00:00
m0HWFA6xzRy6CcvU,https://www.haaretz.co.il/news/politics/2025-09-28/ty-article/.premium/00000199-8e89-dbe0-af9d-9ee9d9f80000,"דיווח: תוכנית טראמפ לעסקת חטופים כוללת שחרור של 250 אסירי עולם ו־1,700 עזתים","בוושינגטון פוסט דווח כי בתוך 48 שעות מתחילת הפסקת האש ישוחררו כל החטופים החיים ""ויותר מ־24 גופות של חטופים"". ברצועה מוחזקים 26 חטופים שנקבע מותם ועוד שניים שקיים חשש כבד לחייהם",חדשות|מדיני ביטחוני,m0HWFA6xzRy6CcvU.jpg,"מפגינים למען החטופים בתל אביב, אתמול. לפי הדיווח, המתווה האמריקאי כולל שחרור של כל החטופים החיים בתוך 48 שעות מתחילת הפסקת האש. צילום: איתי רון",haaretz,2025-09-28T07:55:42+03:00,,הארץ,haaretz,he,245822,2025-09-28T09:04:04.839493+00:00
Xw7s6JxeN8CV1h6M,https://www.haaretz.co.il/gallery/television/tv-review/2025-09-28/ty-article-review/.highlight/00000199-8e99-d27b-affd-de997b500000,"""מובלנד"": דרמת פשע בריטית שלא מהססת לפעול לפי הנוסחה","""מובלנד"" אינה שואפת לשנות את חוקי הז'אנר, אבל הביצוע סוחף. הסדרה נשענת על שחקנים מצוינים המדלגים במיומנות בין איפוק מחושב לאלימות פרועה",תרבות|ביקורת טלוויזיה,Xw7s6JxeN8CV1h6M.jpg,"בנימין נתניהו, מתוך הפרק החמישי של ""סאות' פארק"". ""אל תגלגל לי עיניים!"". צילום: צילוך מסך מתוך comedy central",haaretz,2025-09-28T07:41:13+03:00,,חן חדד,haaretz,he,63216556,2025-09-28T06:14:39.633803+00:00
HMs2Uo9mZKaZdFGS,https://www.haaretz.co.il/blogs/photoblog/2025-09-28/ty-article-magazine/00000199-7f9f-db6e-a5d9-ffff3a1c0000,"""הד פעולה"": כשצילום ופיסול נהפכים למקשה אחת","עבודותיו של אוהד מטלון מערערות על גבולות המדיום, ויוצרות זירות משתנות של הופעה והיעלמות",בלוגים|בלוג הצילום של הארץ,HMs2Uo9mZKaZdFGS.jpeg,ג,haaretz,2025-09-28T07:02:01+03:00,,חשיפה,haaretz,he,1,2025-09-28T06:14:39.633834+00:00
ppm58gzD4FRSxpPk,https://www.haaretz.co.il/sport/world-soccer/2025-09-28/ty-article/00000199-8e5b-d772-a59f-8e7fcfdb0000,"דור תורג'מן כבש ובישל בבכורה אחרי שעלה מהספסל, ניו אינגלנד ניצחה 0:2 את אטלנטה","במשחקו הראשון ב-MLS, חודש לאחר שעבר ממכבי תל אביב, היה אחראי חלוץ הנבחרת דור תורג'מן לשני השערים בניצחון של ניו אינגלנד רבולושן על אטלנטה ונבחר לשחקן המצטיין. המשחק הבא: בחוץ נגד ליאו מסי ואינטר מיאמי",ספורט|כדורגל בעולם,ppm58gzD4FRSxpPk.gif,"דור תורג'מן כובש את השער הראשון של ניו אינגלנד נגד אטלנטה, הלילה.",haaretz,2025-09-28T06:55:27+03:00,,ספורט הארץ,haaretz,he,a7fo67,2025-09-28T06:14:39.633864+00:00
OyZNRQGRgRFI5FJv,https://www.haaretz.co.il/food/2025-09-28/ty-article-magazine/.premium/00000199-7f61-daea-adff-7fe3fdf30000,הסושי פופולרי מתמיד באמריקה – ויש לזה סיבה אחת,"האמריקאים אוכלים אותו בבוקר בקמפוס, בערב בחתונה ובדרך חזרה מהעבודה בתחנת הדלק. הסושי שזכה לפריחה מחודשת בתקופת הקורונה, כבר מזמן לא שייך רק למסעדות יפניות יוקרתיות",אוכל,OyZNRQGRgRFI5FJv.jpg,צילום: דודו בכר,haaretz,2025-09-28T06:30:21+03:00,,ניו יורק טיימס,haaretz,he,216404,2025-09-28T03:34:40.747333+00:00
IBSFuRZI7qHCmcaX,https://www.haaretz.co.il/news/politics/2025-09-28/ty-article/.premium/00000199-8cad-d04a-adfd-bdad65fd0000,"מבעד לנאום נתניהו עמוס השקרים על עזה, בצבצה אמת נוראה","ישראל לא הרעיבה את העזתים? נתניהו עצמו התגאה בכך. היחס בין לא מעורבים וחמושים שנהרגו הוא 1:2? כל ההערכות קודרות בהרבה. אבל יותר מהשקרים, החלק המטריד בדברי נתניהו על במת האו""ם היתה האמת",חדשות|מדיני ביטחוני,IBSFuRZI7qHCmcaX.jpg,"תקיפות ישראל בעזה, אתמול. על פי נתונים שפורסמו לאחרונה, היחס בין מספר האזרחים למחבלים שנהרגו עומד על בין 1:8 ל־1:10. צילום: Mahmoud Issa/רויטרס",haaretz,2025-09-28T06:01:02+03:00,,ניר חסון,haaretz,he,63211431,2025-09-28T03:34:40.747417+00:00
E7H1Q9L1V_EY9ytc,https://www.haaretz.co.il/news/politics/2025-09-28/ty-article/.highlight/00000199-8c74-d772-a59f-8e74cdb00000,"בין הסדר ביטחון עם ישראל ליציבות המשטר בסוריה מפריד ""מסדרון הומניטרי""",א-שרע חושש כי דרישת ישראל לכונן לעצמה מרחב שליטה בארצו לטובת הדרוזים תוביל להפיכת סוריה לאוסף של אוטונומיות המנותקות מהממשל. התעקשות על כך תסכן את החתימה על הסדר ביטחון,חדשות|מדיני ביטחוני,E7H1Q9L1V_EY9ytc.jpg,"דני שק בכיכר החטופים בתל אביב, אתמול. ""אופטימיות זה מצב מנטלי, אני מעדיף את המילה תקווה"", אמר. צילום: איתי רון",haaretz,2025-09-28T06:00:58+03:00,,צבי בראל,haaretz,he,248374,2025-09-28T03:34:40.747455+00:00
R-c2VQ-AIWy5OVSj,https://www.haaretz.co.il/gallery/television/tv-review/2025-09-28/ty-article/.highlight/00000199-8ca6-d04a-adfd-bda6e2c30000,המלצה למוריה אסרף: תלמדי מסאות' פארק איך להפסיק להתחנף,"משדר נאום נתניהו בעצרת האו""ם, חדשות 13",תרבות|ביקורת טלוויזיה,R-c2VQ-AIWy5OVSj.jpg,"בנימין נתניהו, מתוך הפרק החמישי של ""סאות' פארק"". ""אל תגלגל לי עיניים!"". צילום: צילוך מסך מתוך comedy central",haaretz,2025-09-28T06:00:52+03:00,,יסמין לוי,haaretz,he,63211272,2025-09-28T03:34:40.747487+00:00
1JVzLZcCqxwqcIW2,https://www.haaretz.co.il/wellbeing/health-blogs/environment/2025-09-28/ty-article/.premium/00000199-8ca7-daea-adff-bfe70b170000,"מחקר מאשר שאורח חיים מאורגן, ובעיקר פעיל, תורם לאריכות ימים","כדי להגיע לשיבה טובה נדרשים הרגלים טובים, אבל מסתבר שגם למבנה האישיות שתומך בהם יש השפעה מבורכת",לחיות נכון|בריאות וסביבה,1JVzLZcCqxwqcIW2.jpg,"דני שק בכיכר החטופים בתל אביב, אתמול. ""אופטימיות זה מצב מנטלי, אני מעדיף את המילה תקווה"", אמר. צילום: איתי רון",haaretz,2025-09-28T06:00:49+03:00,,גרדיאן,haaretz,he,63210432,2025-09-28T03:34:40.747516+00:00
9T2W2X7RNGMsOf1e,https://www.haaretz.co.il/news/politics/kolkore/2025-09-28/ty-article/00000199-8ad8-d04a-adfd-bfd8c9410000,"""פנייתו של נתניהו לחטופים הייתה אמינה יותר אם לא היה מטרפד את שחרורם""","הדיפלומט הבכיר לשעבר דני שק מרכז יחד עם רעייתו, ח""כ לשעבר אמילי מואטי, את הטיפול בנושאים הבינלאומיים והדיפלומטיים של מטה משפחות החטופים. לדבריו, קרובי חטופים שמחזיקים באזרחות כפולה אמרו לו כל הזמן שפגשו ראשי מדינות אחרות יותר משפגשו את ראש הממשלה ■ אלו אירועי המחאה הצפויים היום",חדשות|קול קורא לשחרורם,9T2W2X7RNGMsOf1e.jpg,"דני שק בכיכר החטופים בתל אביב, אתמול. ""אופטימיות זה מצב מנטלי, אני מעדיף את המילה תקווה"", אמר. צילום: איתי רון",haaretz,2025-09-28T06:00:46+03:00,,נועה לימונה,haaretz,he,246832,2025-09-28T03:34:40.747545+00:00
N-g6aiCYvVj5yHhB,https://www.haaretz.co.il/sport/nba/2025-09-28/ty-article-magazine/.premium/00000199-8c3e-daea-adff-bfffc2ff0000,"כדי להשתלט על אירופה, הליגה החדשה של ה-NBA לוקחת השראה מהכדורגל","הליגה האירופית של ה-NBA, שצפויה לקום בשלוש השנים הקרובות, שואפת לשנות את נוף הכדורסל באירופה ולמנף את מה שעבד בכדורגל במשך עשרות שנים",ספורט|NBA,N-g6aiCYvVj5yHhB.jpg,"אולם לפני פתיחת משחק ב-NBA, ב-2017. הליגה מקווה לנצל את בסיסי האוהדים הגדולים שישנם באירופה. צילום: Kelley L Cox/רויטרס",haaretz,2025-09-28T06:00:43+03:00,,האתלטיק,haaretz,he,778611,2025-09-28T03:34:40.747576+00:00
xjnVr1HE7bGDGzXS,https://www.haaretz.co.il/gallery/television/guide/2025-09-28/ty-article/.premium/00000199-8bd2-daea-adff-bff37dbf0000,"""תיקון מידות"": מותחן מקברי שמספק את יצר המציצנות","הסדרה החדשה של הקומיקאי הא־בינארי מיי מרטין (ג'ורג' ומיי) שמשחק בתפקיד הראשי שוטר טרנסג'נדר, היא סדרת מסתורין בינונית, קלישאתית ודידקטית",תרבות|מדריך צפייה,xjnVr1HE7bGDGzXS.jpg,"טוני קולט (מימין) וריי מרטין ב""תיקון מידות"". נקודת תורפה. צילום: Michael Gibson / Netflix",haaretz,2025-09-28T06:00:39+03:00,,גילי איזיקוביץ,haaretz,he,63184515,2025-09-28T03:34:40.747620+00:00
UXnrSOEy4-0htqzb,https://www.haaretz.co.il/gallery/music/musicreview/weekly/2025-09-28/ty-article/.premium/00000199-7f96-d69f-adf9-ffbf1eda0000,"""התקווה 6"" ורביד פלוטניק מייחסים לכוכב נופל את התכונה הישראלית המקודשת ביותר","ב""איזה מזל"", ""התקווה 6"" מגייסת את גרמי השמים לאקט אבסורדי של אתוס הגבורה וההקרבה",תרבות|שיר בשבוע,UXnrSOEy4-0htqzb.jpg,"""התקווה 6"". מותחת את ההיגיון השירי עד לקצה. צילום: משה נחומוביץ",haaretz,2025-09-28T06:00:26+03:00,,בן שלו,haaretz,he,216350,2025-09-28T03:34:40.747655+00:00
YHYbcG8MsX6ZtAH9,https://www.haaretz.co.il/gallery/theater/2025-09-28/ty-article-magazine/.premium/00000199-5c7d-dc75-a1d9-5f7d741b0000,"אורי סעדה: ""ההצגה הזו היא ריפוי בשבילי""","את הצגת היחיד שלו על העברה דורית של אלימות כתב סעדה לפני שתכנן להביא ילד לעולם. כעת, כשאשתו בהריון, היא מקבלת משנה תוקף",תרבות|תיאטרון,YHYbcG8MsX6ZtAH9.jpg,"אורי סעדה. ""אבא שלי אמר: 'בחיים אל תרים יד'"". צילום: דוד בכר",haaretz,2025-09-28T06:00:19+03:00,,טליה בנון צור,haaretz,he,63089503,2025-09-28T03:34:40.747684+00:00
1sZhwuwe3prGrb_R,https://www.haaretz.co.il/gallery/israeli-love/2025-09-28/ty-article/.premium/00000199-84ed-dddf-a39f-c5fdaa6b0000,שום דבר לא הכין אותי ללילות שבהם הוא היה יוצא לפגוש גברים,"כשעמדתי איתו מתחת לחופה ביום נישואינו הרגשתי בת מזל מאין כמותה. כשנפרדנו לא בכיתי עליו, אלא על הענק טוב הלב",תרבות|רומן ישראלי,1sZhwuwe3prGrb_R.jpg,צילום: לי-אור עצמון פרואין,haaretz,2025-09-28T06:00:15+03:00,,אלונה זהבי,haaretz,he,241224-3,2025-09-28T03:34:40.747709+00:00
dKf9XaPgzEgwjILJ,https://www.haaretz.co.il/family/askingforafriend/2025-09-28/ty-article/.premium/00000199-5301-d7ad-a1d9-5379e79f0000,אני אוהבת לגלות את נקודת החולשה של הפרטנר שלי,הארץ,משפחה|שואלת בשביל חברה,dKf9XaPgzEgwjILJ.jpg,איור: שקד בשן,haaretz,2025-09-28T06:00:12+03:00,,שקד בשן,haaretz,he,story226b-04,2025-09-28T03:34:40.747737+00:00
PcD9LiZ0uMxVgdUj,https://www.haaretz.co.il/family/2025-09-28/ty-article-magazine/.premium/00000199-5ce9-d45d-a3bf-ffebf5340000,"מה הקשר בין מחדד, מדוזה ואודם? כולם חלק משפה סודית של המתבגרים שלכם","בני נוער מרגישים בטוחים לדבר בטיקטוק על הקושי הנפשי דרך צפנים, אך חשיפה מוגברת לנושאים קשים עשויה לנרמל ואפילו לעשות רומנטיזציה לפגיעה עצמית. האם הסכנה ממשית ואיך לדבר איתם על תכנים רגישים?",משפחה,PcD9LiZ0uMxVgdUj.gif,"אם נער או נערה מרגישים שלא רואים אותם, תוכן קשה עשוי לשמש כדי לעורר אמפתיה. איור: מאשה צור-גלוזמן",haaretz,2025-09-28T06:00:09+03:00,,אסתי אפרים ומיה מגנט,haaretz,he,family-tiktokcodes-21-09-2025-tiktokcodes-promotion,2025-09-28T03:34:40.747762+00:00
