article_id,guid,title,description,category,image,image_caption,image_credit,pub_date,tags,author,source,language,image_name,fetching_time
9vWysMA6-cRQcFfr,https://www.israelhayom.co.il/forreal/15_minutes/article/18880465,"""לא ידעתי לאן אני נכנס"": יובל לוי מסכם","זוכה ""האח הגדול"" של העונה ששברה שיאים החליט להעלות פוסט סיכום בו הוא סוגר מעגל עם החוויה ומבטיחה למעריצים שזו רק ההתחלה",15 דקות,9vWysMA6-cRQcFfr.jpeg,יובל לוי הוא הזוכה באח הגדול 2025,אורן בן חקון,2025-09-18T15:34:54+03:00,האח הגדול|יובל לוי,אביטל אביב,hayom,he,WhatsApp-Image-2025-09-13-at-23.57.18,2025-09-18T22:57:32.699254+00:00
eApG6CURAWKGwYLs,https://www.israelhayom.co.il/news/law/article/18880353,"באמצע החקירה: אמה של מאי גולן יצאה לשירותים, השרה הבריחה אותה מהתחנה","""השרה משתמשת בחסינות שלה כדי להוציא את אמא שלה מחדר החקירות"" אמר גורם במשטרה • ""נתייעץ עם הגורמים המשפטיים הרלוונטיים ונקבל החלטות כיצד לנהוג״ • במקביל, ביאח""ה החליטו לשחרר למעצר בית שניים מהחשודים בפרשת השחיתות במשרדה של השרה",משפט,eApG6CURAWKGwYLs.jpg,מאי גולן. תיחקר במשטרה,"יוסי זליגר, אורן בן חקון, דוברות המשטרה",2025-09-18T15:32:03+03:00,,איציק סבן,hayom,he,אורן-בן-חקון-יוסי-זליגר-דוברות-המשטרה,2025-09-18T22:57:32.699281+00:00
adINyZyzHT60oCnm,https://www.israelhayom.co.il/military-life/article/18880217,"בנוכחות רה""מ נתניהו: רחוב בשוהם ייקרא על שם חלל צה""ל ממלחמת חרבות ברזל","""רחוב עמית"" ייחנך בטקס מיוחד בעיר - לזכרו של סמ""ר עמית בונצל ז""ל • האירוע ייערך בנוכחות רה""מ, שר הביטחון כ""ץ, שרים וחברי כנסת נוספים",חיילים,adINyZyzHT60oCnm.jpg,עמית בונצל שנפל בקרבות ברצועת עזה,"דובר צה""ל",2025-09-18T15:30:43+03:00,"בנימין נתניהו|ישראל כ""ץ|מלחמת חרבות ברזל|רחוב|שוהם",אביטל פריד,hayom,he,דובר-צהל-1-7.12,2025-09-18T22:57:32.699308+00:00
6BUwnd8jvcoHV5CF,https://www.israelhayom.co.il/magazine/hashavua/article/18876883,"התוכנית הנסתרת של חמאס נחשפת: ""מעין מחנות ריכוז ואוניות לפינוי יהודים""","חודשים לפני 7 באוקטובר הזהיר חוקר חמאס יהונתן דחוח־הלוי מ""טבח כמו פרעות תרפ""ט"". איש לא שעה לדבריו • שנתיים למלחמה, מדבר איש המודיעין לשעבר על מחקריו במרכז הירושלמי לענייני חוץ וביטחון, הסימנים שהוחמצו ומזימת ארגון הטרור: ""תכנן מי להרוג ומי להשאיר בחיים""",ישראל השבוע,6BUwnd8jvcoHV5CF.jpg,"""חמאס זה עזה, ועזה זה חמאס"". פריצת הגדר ב-7 באוקטובר",רויטרס,2025-09-18T15:29:25+03:00,7 באוקטובר|חמאס|מלחמת חרבות ברזל|רצועת עזה,נדב שרגאי,hayom,he,ראשית-רויטרס,2025-09-18T22:57:32.699336+00:00
YHz9Z9IS9V-8f5ob,https://www.israelhayom.co.il/forreal/localy/article/18880200,לשבות רעב? אלונה סער כועסת,"השחקנית ובתו של שר החוץ שיתפה צילום מסך של הודעה פרטית שנשלחה אליה ובה הצעה לשבות רעב. ""אין מילים בפי""",מפה,YHz9Z9IS9V-8f5ob.jpg,הצעה שהכעיסה אותה. אלונה סער,יחצ,2025-09-18T15:28:45+03:00,אלונה סער|גדעון סער,יוסי דלאל,hayom,he,אלונה-סער,2025-09-18T22:57:32.699364+00:00
1dGk6sHn3svnAmPT,https://www.israelhayom.co.il/sport/world-soccer/article/18879939,"חבר הפרלמנט הבריטי: ""לבטל את המשחק מול מכבי תל אביב""","הצהובים אמורים להתארח אצל אסטון וילה ב-6 בנובמבר ואיוב חאן, שמייצג את בירמינגהם, יצא בקריאה פרובוקטיבית • ""קורא לאופ""א, לשר התרבות ולמועדון עצמו לבטל בדחיפות את המשחק או לנקוט בצעדים מיידיים להבטחת שלום הציבור וההרמוניה בקהילה"" • הוא ציין את הלינץ' באמסטרדם כאירוע שבו אשמים אוהדי האלופה: ""אין מקום לבריונים""",כדורגל עולמי,1dGk6sHn3svnAmPT.jpg,שחקני מכבי תל אביב חוגגים,אלן שיבר,2025-09-18T15:28:24+03:00,אסטון וילה|החרם על ישראל|ליגה אירופית|מכבי תל אביב|פרו פלשתינים,מערכת ספורט היום,hayom,he,New_ALAN0976-2,2025-09-18T22:57:32.699394+00:00
U4iB893WaEJxzyeh,https://www.israelhayom.co.il/magazine/hashavua/article/18880092,"שנקום ויתברר שהכל היה סיוט: תקוות תשפ""ו","שום גורם לא יוכל להבטיח לרבנים שהמתגייסים יסיימו את שירותם כחרדים, משום שהם אנשים חופשיים, העשויים להחליף כיפה או אפילו להתפקר • ובית המשפט? הוא טעה טעות קשה כאפשר לנתניהו להציג את מועמדותו בפני הכנסת לכהונה נוספת - את הטעות חייבים לתקן",ישראל השבוע,U4iB893WaEJxzyeh.jpg,חיילינו מקבלים את השנה החדשה בלב עזה,אורן כהן,2025-09-18T15:21:43+03:00,,יוסי ביילין,hayom,he,אורן-כהן,2025-09-18T22:57:32.699422+00:00
UPz0jmtpcDofzytt,https://www.israelhayom.co.il/tech/tech-news/article/18880203,שיתוף פעולה היסטורי: אינטל ואנבידיה יפתחו יחד תשתיות AI ומוצרי מחשוב אישי,"אינטל תתכנן ותייצר עבור אנבידיה מעבדי דאטה סנטר ומחשוב אישי מותאמים אישית, שישלבו את טכנולוגיית NVLink • במקביל, אנבידיה תשקיע 5 מיליארד דולר במניות אינטל",חדשות טכנולוגיה,UPz0jmtpcDofzytt.jpg,אנבידיה ואינטל,אי.אף.פי,2025-09-18T15:18:32+03:00,,רועי בית לוי,hayom,he,AFP_74XX3KF,2025-09-18T22:57:32.699448+00:00
nXdZ8aqIumtxFIgw,https://www.israelhayom.co.il/forreal/forlife/article/18817081,"דני לוי: ""נורת' היא המוזה שלי""","בחלק השני של הראיון ל""ביג שיק"", הסטייליסטית של קים קרדשיאן חוזרת לרגעי השיא עם ריהאנה, מסבירה איך נולדה שותפות בלנסיאגה-קרדשיאן, חושפת את האפליקציה הסודית של הארון הכי מפורסם בעולם, ומסמנת את המוזה שלה",פורלייף,nXdZ8aqIumtxFIgw.jpeg,"דני לוי באולפן ""BIG CHIC""",ForReal,2025-09-10T10:04:55+03:00,BIG CHIC|דני לוי|קים קרדשיאן,ערן סויסה,hayom,he,Danny-Part-II-Main,2025-09-18T22:57:32.696347+00:00
vUcVpRa8fqiEt5Mw,https://www.israelhayom.co.il/forreal/paparazzi/article/16260779,גיא איתן עוזר לעיוור,"הסלב המכונה ""זקנבוט"" נתפס בעדשת הפפראצי כשהוא עושה מעשה טוב קלאסי",פפראצי,vUcVpRa8fqiEt5Mw.jpeg,גיא איתן ועיוור (2),מערכת FoReal,2024-08-14T17:24:07+03:00,גיא איתן,מערכת ForReal,hayom,he,גיא-איתן-ועיוור-2,2025-09-18T22:57:32.696440+00:00
