article_id,guid,title,description,category,image,image_caption,image_credit,pub_date,tags,author,source,language,image_name,fetching_time
MuLFPcKVjArekUdu,https://www.israelhayom.co.il/business/article/18884984,"שי לחג בשווי 2,000 שקלים: המפנקים של המשק והחברה שהסתפקה ב-250 לעובדיה","שי לחג הפך להיות עניין מובן מאליו, ומעסיקים רבים לא מוותרים על ההטבה למרות קיצוצים בהטבות אחרות • אילו חברות מובילות במתנות? • מי החליטו ללכת על שי צנוע? • וכמה עדיין מביאים מתנה במקום שובר?",כלכלה,MuLFPcKVjArekUdu.jpg,שובר מתנה,GettyImages,2025-09-19T03:48:34+03:00,"בז""ן|חגי תשרי",היאלי יעקבי-הנדלסמן,hayom,he,GettyImages-509873266,2025-09-19T03:03:51.726248+00:00
BYzx7XaivrJrYViB,https://www.israelhayom.co.il/magazine/hashavua/article/18884947,"אחרי החגים יקוצץ הכל: ""המטבחון"" מהדק חגורות","אפילו בחדר האוכל אין לאן לברוח: פתאום רוצים שנתחיל להביא ארוחות מהבית • מישהו אמר משק אוטרקי? • מדור ""המטבחון"" פותח שנה חדשה",ישראל השבוע,BYzx7XaivrJrYViB.jpg,.,.,2025-09-19T03:29:53+03:00,המטבחון|קיצוצים|ראש השנה,טל לזר|עדי רובינשטיין,hayom,he,המטבחון-חג-שמח-משק-אוטרקי-לדיגיטל-06-Artboard-8,2025-09-19T03:03:51.726293+00:00
-mkGKXqT1RqSknBK,https://www.israelhayom.co.il/business/article/18884921,חגי תשרי: זכויות עובדים ומילואימניקים - כל מה שצריך לדעת,"עובדים רבים לא בטוחים מה זכויותיהם בתקופה החגים • האם חובה לעבוד אצל מעסיק שפועל במהלך החג? • ומה קורה אם החליט על חופשה כפויה לכל העובדים? • איך מבוצע תשלום של שעות נוספות והאם מגיע שי לחג? • ומה זכויות המילואימניקים שנמצאים הרחק מהבית? • ""ישראל היום"" עושה סדר",כלכלה,-mkGKXqT1RqSknBK.jpg,דבש (אילוסטרציה),Getty Images,2025-09-19T03:13:54+03:00,חיילי מילואים|עובדים,היאלי יעקבי-הנדלסמן,hayom,he,hiney2,2025-09-19T03:03:51.726329+00:00
c6Zt6pdQTiqXZHZX,https://www.israelhayom.co.il/judaism/judaism-news/article/18877564,"""משהו יוצא דופן"": למה דבש נחשב כשר למרות שהוא מגיע מחרק?","רגע לפני שיככב על שולחן החג בראש השנה, הרב אלדד זמיר מסביר מדוע אפשר לאכול דבש: ""זו בדיוק הדוגמה למשהו שהוא מן הכלל"" • ""שאלת רב"" - פרק תשיעי בסדרה",חדשות היהדות,c6Zt6pdQTiqXZHZX.jpg,מדוע דבש נחשב כשר למרות שמגיע מחרק?,גטי אימג'ס,2025-09-19T03:04:26+03:00,דבש|חגי תשרי|ראש השנה,מערכת ישראל היום,hayom,he,GettyImages-641443764,2025-09-19T03:03:51.726367+00:00
wusmcOuKwOXJP8S_,https://www.israelhayom.co.il/magazine/shishabat/article/18884900,"שנהיה לראש, אבל בבקשה לא הראש שלהם","קבלו תשעה טיפוסים של חג • את כולם אתם מכירים היטב, ואיתם הכי כיף לפתוח את השנה החדשה. מה, לא? • מחליפה צבעים",שישבת,wusmcOuKwOXJP8S_.jpg,מחליפה צבעים: מדור מאויר חדש,של הילה נועם,2025-09-19T03:03:27+03:00,ארוחת חג|הורות|ראש השנה,הילה נועם,hayom,he,header,2025-09-19T03:03:51.726399+00:00
roByFvMagjm-LOzK,https://www.israelhayom.co.il/magazine/hashavua/article/18855731,"סקר ""ישראל השבוע"": האם אתם חוששים מרצח פוליטי בישראל?","ההתנקשות בצ'ארלי קירק בארה""ב מעלה חשש לאלימות פוליטית קטלנית גם אצלנו • בדקנו מה חושב הציבור על תרחיש האימים, ומאיזה מחנה מגיעה לדעתו הסכנה - הימין או השמאל",ישראל השבוע,roByFvMagjm-LOzK.jpg,בשני המחנות צריכים לוודא שלא גדלים עשבי פרא בחצר הקדמית. צ'ארלי קירק,אי. אף. פי,2025-09-19T02:37:51+03:00,צ'ארלי קירק|רצח רבין,מערכת ישראל היום,hayom,he,המדגם-השבועי-ראשית-AFP,2025-09-19T03:03:51.726428+00:00
p3DD3_zGL6JRulJf,https://www.israelhayom.co.il/judaism/article/18884848,"מדהים: מחזור תפילה עתיק מליסבון, שחלקיו לא נמצאו במשך שנים – אוחד בירושלים","שלושת החלקים מתאחדים לראשונה כעת לאחר שהיו מפוצלים במשך זמן לא ידוע, לאחר ששניים התגלו במסגרת מכירה פומבית • המחזור כולל תפילות ופיוטים לימים הנוראים ולמועדים נוספים בנוסח ספרדי • כעת הוא יישמר בספרייה הלאומית בתנאים מיטביים",יהדות,p3DD3_zGL6JRulJf.jpeg,"המחזור הנדיר מליסבון, מהמאה ה-15",הספרייה הלאומית,2025-09-19T02:34:22+03:00,הימים הנוראים|תפילה,לידור סולטן,hayom,he,WhatsApp-Image-2025-09-18-at-17.19.39,2025-09-19T03:03:51.726459+00:00
Y8zdgAymWob7RovR,https://www.israelhayom.co.il/tech/article/18877170,זו המהפכה האמיתית של האייפון אייר,"בזמן שכולם מדברים על העיצוב הדקיק, מומחה שהוביל את פיתוח הסוללות של טסלה חושף: הפריצת דרך האמיתית נמצאת במקום אחר לגמרי",טכנולוגיה ומדע,Y8zdgAymWob7RovR.jpg,"אייפון אייר. ""הסוללה באייפון החדש היא יוצאת דופן""",REUTERS,2025-09-19T02:30:35+03:00,אייפון|אייפון 17|אפל|טכנולוגיה|סוללות,מערכת ישראל היום,hayom,he,7_RC2KOGANXGO7_RTRMADP_3_APPLE-EVENT,2025-09-19T03:03:51.726489+00:00
YYvrbeSrmWGNPv0f,https://www.haaretz.co.il/magazine/underthesun/2025-09-19/ty-article/.highlight/00000199-578f-d907-a5db-77ef3afd0000,למעשים של ישראל יש קורבנות. הסיפור הזה הוא לא עלינו,"ישראלים מרבים להתלונן שהעולם אובססיבי לנעשה כאן, ולא מתעניין באופן דומה בסכסוכים אחרים. האמת היא שהישראלים אוהבים את זה",סוף שבוע|תחת השמש,YYvrbeSrmWGNPv0f.jpg,"צילום: חשבונות האינסטגרם וה–X של מירי רגב, Israel Heritage Foundation, ניסים סטיב אללוף, משה בן זקן ו–5 tjt.com; עיבוד והנפשה: מאשה צור גלוזמן",haaretz,2025-09-19T02:11:14+03:00,,עפרי אילני,haaretz,he,878072,2025-09-19T03:04:06.516456+00:00
ynLtPH7lBrlrKD18,https://www.israelhayom.co.il/magazine/hashavua/article/18855751,היא אחת משלנו. עם כל הצער שבדבר,"לזוכת האמי היהודייה, האנה איינבינדר, חשוב שהעולם יבדיל בין יהודים למדינת ישראל, ושתשוחרר פלשתין • שמישהו יספר לה שאם תשוחרר פלשתין, לא תהיה לה מדינת יהודים לחזור אליה, להקיש בדלתה ולומר: ""תנו לי להיכנס, אני משלכם""",ישראל השבוע,ynLtPH7lBrlrKD18.jpg,"אוי, האנה, מתי תחברי את הנקודות? איינבינדר נואמת בטקס האמי, השבוע",אי. פי. אי,2025-09-19T02:09:17+03:00,אנטישמיות|טקס פרסי האמי|יהדות ארה''ב,שי גולדן,hayom,he,ראשית-אי.פי.אי,2025-09-19T03:03:51.726516+00:00
91gL1379ZRxdJ_Zd,https://www.israelhayom.co.il/news/world-news/europe/article/18884774,דגל פלשתין על העירייה: שורת ההחלטות המקוממות של רומא,"מפלגות שמאל בעיריית רומא הנהיגו רוב שהביא לגינוי של ישראל על ידי הבירה האיטלקית • בתוך כך, גם התקבלה החלטה להתנער ממזכר הבנות שנחתם עם חברת מקורות, למרות שממילא פג תוקפו • ""מגנים את המתקפה האחרונה נגד העיר עזה""",אירופה,91gL1379ZRxdJ_Zd.jpg,הפגנה פרו פלשתינית ברומא (ארכיון),EPA,2025-09-19T02:05:58+03:00,איטליה|פרו פלשתינים|רומא,"ניסן שטראוכלר, כתבנו באירופה",hayom,he,11656111,2025-09-19T03:03:51.726543+00:00
AoHOYhax4B6d-Su2,https://www.ynet.co.il/news/article/s1lr6l5oxg,"מאי גולן מכחישה ש""הבריחה"" את אמה מהתחנה: ""היא תיחקר שוב - וכך גם אני"" | זו גרסתה","השרה שחשודה בפלילים טענה כי לא מילטה את אמה מחקירתה במשטרה, אלא לקחה אותה לבדיקה רפואית כי חשה ברע: ""אף שוטר לא עצר אותי, חוקרת ליוותה אותנו עד הרכב. התחנה נפתחת רק עם שער חשמלי כבד"". לדבריה, ""אגיע להיחקר אחרי שישוחררו כל האנשים שכל חטאם היה המקורבות אליי. אין לי מה להסתיר""",חדשות|חדשות בארץ|משפט ופלילים,AoHOYhax4B6d-Su2.jpg,מאי גולן ואימה רימונה,צילום: דוברות הכנסת,2025-09-19T01:54:40+03:00,שחיתות|מאי גולן,ynet,ynet,he,ByqF3KKjex_1_68_1280_721_0_medium,2025-09-19T03:03:16.307560+00:00
T6bO_CiaCurtnbY8,https://www.israelhayom.co.il/magazine/hashavua/article/18855783,"אינס אליאס עונה לטוקבקיסט שמאשים את הימין במצב בדרום ת""א","גולש טען כי גם אחרי עשורים של שלטון הליכוד, ועם בן גביר כשר לביטחון הפנים, הפשיעה רק גוברת • אינס אליאס שרטטה לו את הקשר החמקמק בין המאבק בעבריינים למלחמה שמתנהלת נגד בחירת העם",ישראל השבוע,T6bO_CiaCurtnbY8.jpg,"צדק עושים במערכת המשפט, בקלפי וגם בשמירה על הביטחון ברחובות. מפגינים בדרום ת""א",יהושע יוסף,2025-09-19T01:39:50+03:00,גירוש המסתננים|דרום תל אביב|הליכוד|זכות התגובה,אינס אליאס,hayom,he,זכות-התגובה-ראשית,2025-09-19T03:03:51.726571+00:00
8Z7JoW-UUU6Gmzc6,https://www.israelhayom.co.il/news/defense/article/18884733,"בן 57, תושב ירדן, עבד במשאיות האספקה לעזה: פרטים חדשים על המחבל ממעבר אלנבי","המחבל עבד במשאיות האספקה זה שלושה חודשים • ירדן פרסמה את פרטיו וגינתה את הפיגוע: ""הפרה של החוק וסיכון של האינטרסים של ירדן ויכולתה לספק סיוע לרצועת עזה""",ביטחוני,8Z7JoW-UUU6Gmzc6.jpeg,זירת הפיגוע במעבר אלנבי,יוני ריקנר,2025-09-19T01:36:59+03:00,,שחר קליימן,hayom,he,WhatsApp-Image-2025-09-18-at-15.37.01,2025-09-19T03:03:51.726599+00:00
yr9sh_O6c2LIIW6n,https://www.israelhayom.co.il/lifestyle/well-being-and-fitness/article/18877141,מומחים פיתחו כרית שאמורה לגרום לכם לישון טוב יותר,"הכרית החכמה מפיקה צלילים ייחודיים, מאריכה את זמן ה־REM, מפחיתה יקיצות ב-31% - ומבטיחה להחזיר לכם שינה עמוקה, אנרגיה מחודשת ומצב רוח מאוזן",בריאות וכושר,yr9sh_O6c2LIIW6n.jpg,שינה טובה זה משהו שכולנו רוצים,istockphoto,2025-09-19T01:12:46+03:00,אורח חיים בריא|הרגלי שינה|וולנס,מערכת ישראל היום,hayom,he,GettyImages-1212158838,2025-09-19T03:03:51.726630+00:00
fm_fAbm2Zwm9IVfC,https://www.israelhayom.co.il/culture/books/article/18875122,"""הכל היה כמעט. כמעט הגעתי לאוורסט - ובום חזרתי לאדמה. לא ידעתי מה לחשוב""","יעל טבת קלגסבלד תמיד הציבה בספריה דמויות הקרובות לביוגרפיה הפרטית שלה, אך הפעם התרחקה מכך במכוון • עם יציאת הרומן החדש שלה, ""השמש לא מעניינת אותי"", היא מספרת למה התמקדה דווקא ביחסים העכורים שבין אימהות לבנות, ומודה: ""כתבתי את כל הפחדים שלי""",ספרים,fm_fAbm2Zwm9IVfC.jpg,"יעל טבת קלגסבלד. ""ב־7 באוקטובר העט נפל לי מהיד. הפסקתי לכתוב. חשבתי: את מי זה מעניין?""",אריק סולטן,2025-09-19T01:01:32+03:00,מגזין,דפנה לוי,hayom,he,יעל-טבת,2025-09-19T03:03:51.726662+00:00
uP0xAeQlryUwlEyS,https://www.ynet.co.il/news/article/sj2jhx9sgx,מטאפורת המלצרים: הדרך להבין סוגיית גיוס החרדים,דמיינו שני מלצרים: אחד שממליץ על דג ואחד שממליץ על סטייק. מחקרים מראים מי מהם משדר אמינות גבוהה יותר - ויש פה לקח ליחסי החברה החילונית עם החברה החרדית,חדשות,uP0xAeQlryUwlEyS.jpg,גיוס חרדים,"צילום: דובר צה""ל",2025-09-19T00:54:26+03:00,גיוס חרדים|פסיכולוגיה חברתית,דן אריאלי,ynet,he,rJa11L545gl_0_0_2048_1368_0_medium,2025-09-19T03:03:16.307602+00:00
d6gYcHoe_YWXMy42,https://www.israelhayom.co.il/news/local/article/18884687,לאחר חיפושים ממושכים: נקבע מותו של גבר כבן 60 שטבע בכינרת,"לאחר שרוחצים הבחינו בכך שאיש מבוגר נכנס למים מבלי לצאת במשך שעה ארוכה, סירת סיור משטרתית ערכה חיפושים אחריו במשך זמן רב • לבסוף, נמשה מהמים ללא הכרה וצוות איחוד הצלה נאלץ לקבוע את מותו",בארץ,d6gYcHoe_YWXMy42.jpeg,הטביעה בכינרת הערב,איחוד הצלה,2025-09-19T00:46:38+03:00,איחוד הצלה|הכינרת|טביעה,עידן אבני,hayom,he,WhatsApp-Image-2025-09-19-at-00.35.28,2025-09-19T03:03:51.726694+00:00
shJV0eOJF-6HRclZ,https://www.ynet.co.il/news/article/s1n4oyqogg,"אלמנתו של צ'רלי קירק תיכנס לנעליו: ""לא ניכנע לרשע""","ארגון הצעירים ""Turning Point USA"", שבראשו עמד הפעיל הפרו-ישראלי, הכריז כי אלמנתו אריקה תחליף אותו כמנכ""לית: ""צ'רלי עבד להבטיח ש-TPUSA ישרוד. הניסיון להשמיד את עבודתו - ההזדמנות להפוך אותה לעוצמתית ואיתנה מבעבר""",חדשות|חדשות בעולם,shJV0eOJF-6HRclZ.jpg,אריקה קירק בהצהרה הראשונה אחרי רצח בעלה,"צילום: AP, שימוש לפי סעיף 27א בחוק זכויות יוצרים",2025-09-19T00:43:55+03:00,ארצות הברית|יוטה|צ'רלי קירק,ynet,ynet,he,Bko9RJ5ogg_0_0_850_479_0_medium,2025-09-19T03:03:16.307638+00:00
0Ita8okW3fKm2b7J,https://www.ynet.co.il/news/article/bkfzh6togg,תמרור אזהרה משמעותי: ההתחממות שעלולה לפגוע גם בהישגים בעזה,"אחרי הפיגועים הקטלניים במעבר אלנבי אתמול ובירושלים בשבוע שעבר, ישנו חשש מהתחממות ברחוב הפלסטיני וגל טרור שעלול להתפרץ ברגע. גורם ביטחוני הסביר ל-ynet: ""כשמביטים באירועים האחרונים - זה בהחלט מטריד. כל דבר יכול להדליק אש. רצף פיגועים ש'מצליחים' מייצר הדבקה והשראה""",חדשות|פוליטי מדיני|צבא וביטחון,0Ita8okW3fKm2b7J.jpg,"כוחות צה""ל בזירת הפיגוע במעבר אלנבי",צילום: AP/Mahmoud Illean,2025-09-19T00:39:23+03:00,ירדן|ירושלים|יהודה ושומרון|פיגוע|פיגועים|מרכבות גדעון ב',אלישע בן קימון,ynet,he,rkgjAohtjlx_0_1_3000_1689_0_medium,2025-09-19T03:03:16.307674+00:00
O1wOAj8N5W9DZlJe,https://www.haaretz.co.il/2025-09-19/ty-article-live/00000199-5ebd-d0dc-afdb-debf68620000,"חדשות היום, 19 בספטמבר","תחזית מזג האוויר: ירידה קלה בטמפרטורות, ייתכן טפטוף. גבר בן 57 נפצע קשה מירי בעוספיא. גבר כבן 50 טבע למוות בכנרת",הארץ,O1wOAj8N5W9DZlJe.png,דגעדגע,haaretz,2025-09-19T00:34:48+03:00,,חדשות היום,haaretz,he,htz-share,2025-09-19T03:04:06.516544+00:00
h25A3sLku3L1bCBB,https://www.ynet.co.il/news/article/b1tvc2foee,הסטורי האחרון של רון ביום ההולדת - וברית המילה שממנה מיהר אומרי-חי חזרה לעזה | סיפורי החללים והתמונות,"שישה לוחמים ביום אחד: סגן איתן אבנר בן יצחק (22) מהיישוב הר ברכה נישא רק לפני שלושה חודשים לעטרה, ונפל בפיצוץ המטען ברפיח. סבו של סגן ערן שלם (23) מרמת יוחנן, שנפל גם הוא בעזה, היה ""אגדת צנחנים"" ופיקד על כיבוש החרמון הסורי. סמל אורן הרשקו (20) וסא""ל במיל' יצחק הרוש (68) - שבנו המילואימניק שהה במתחם בזמן האירוע - נהרגו בפיגוע במעבר אלנבי. אלה סיפוריהם",חדשות|פוליטי מדיני|צבא וביטחון,h25A3sLku3L1bCBB.jpg,"סמל אורן הרשקו ז""ל, רס""ן אומרי-חי בן משה ז""ל, סגן ערן שלם ז""ל, סגן רון אריאלי ז""ל, סא""ל (במיל","צילום: דובר צה""ל",2025-09-19T00:25:56+03:00,"צה""ל|עזה|רצועת עזה|רפיח|חללי צה""ל|מרכבות גדעון ב'",מאיר תורג'מן|איתן גליקמן|ליאור אל-חי|אלישע בן קימון|עידן בלומהוף|||עודכן:,ynet,he,SkzF6TKolg_0_0_850_479_0_medium,2025-09-19T03:03:16.307722+00:00
D_vnClichGC34gWW,https://www.haaretz.co.il/news/politics/war-2023/2025-09-19/ty-article-live/00000199-5ea3-d45d-a3bf-ffe398690000,"עינב צנגאוקר לנתניהו מחוץ לביתו בירושלים: ""איך אתה יכול לישון?""","אחיינו של אברהם מונדר נעצר ליד בית רה""מ לאחר ששפך מים על אדם שהתעמת עם המשפחות. אביו של מתן אנגרסט ליד בית רה""מ: דורשים ממנו לשחרר את המדינה מהטירוף. שיירת נתניהו הגיעה לביתו בירושלים; עינב צנגאוקר: ""איך אתה יכול לישון הלילה?""",חדשות|ישראל במלחמה – עדכונים,D_vnClichGC34gWW.jpg,"עינב צנגאוקר מחוץ לבית ראש הממשלה בירושלים, הלילה. צילום: נעמה גרינבאום",haaretz,2025-09-19T00:20:43+03:00,,הארץ,haaretz,he,134619,2025-09-19T03:04:06.516580+00:00
smqdWrsqbxF3u3jN,https://www.haaretz.co.il/news/politics/war-2023/2025-09-19/ty-article-live/00000199-5ea3-d45d-a3bf-ffe398690000,המשטרה פינתה בשנית את מאהל משפחות החטופים סמוך לבית ראש הממשלה בירושלים,"המשטרה פינתה בשנית את מאהל משפחות החטופים סמוך לבית ראש הממשלה בירושלים. מקרון: הרשות הפלסטינית עצרה חשוד במעורבות בפיגוע במסעדת גולדנברג בפריז ב-1982. עשרות מפגינים בגבול הרצועה נגד המלחמה, ארבעה נעצרו",חדשות|ישראל במלחמה – עדכונים,smqdWrsqbxF3u3jN.jpg,"מפגינים למען שחרור החטופים מתעמתים עם אדם אחר בהפגנה ליד מעון רה""מ, אמש. צילום: נעמה גרינבאום",haaretz,2025-09-19T00:20:43+03:00,,"כתבי ""הארץ""",haaretz,he,131277,2025-09-19T12:16:54.301377+00:00
c_Fen-8PQXwJrFV4,https://www.haaretz.co.il/news/politics/war-2023/2025-09-19/ty-article-live/00000199-5ea3-d45d-a3bf-ffe398690000,"שורדת השבי נעמה לוי באו""ם: פחדתי לחיי בכל רגע, צריך להחזיר את כולם עכשיו","דיווח: ממשל טראמפ מתכנן לפנות לקונגרס כדי לאשר מכירת נשק לישראל בשווי שישה מיליארד שקלים. שורדת השבי נעמה לוי באו""ם: פחדתי לחיי בכל רגע, צריך להחזיר את כולם עכשיו. מזכ""ל חיזבאללה לסעודיה: בואו נשים בצד את מחלוקות העבר, ""ישראל היא האויב""",חדשות|ישראל במלחמה – עדכונים,c_Fen-8PQXwJrFV4.jpeg,"לוי נושאת דברים באו""ם, היום. צילום: Hostage Aid Worldwide",haaretz,2025-09-19T00:20:43+03:00,,"כתבי ""הארץ""",haaretz,he,whatsapp-image-2025-09-19-at-18-58-26,2025-09-19T18:14:07.924054+00:00
VcZPg7VUFJaLRF2l,https://www.ynet.co.il/news/article/yokra14521630,כשהנבואות של רואי השחורות מתנפצות מול המציאות,"פוליטיקה ומרמור במסווה של ניתוח מקצועי: הכלכלנים ה""מומחים"" כבר טעו בעבר כשחזו שאם המלחמה תימשך המשק הישראלי יתרסק – אך זה לא מפריע להם להמשיך ולפזר נבואות זעם בלתי מבוססות",חדשות,VcZPg7VUFJaLRF2l.jpg,-yk14522519,צילום: אביגיל עוזי,2025-09-19T00:05:00+03:00,כלכלה|חרבות ברזל,שמואל סלבין ואדם רויטר,ynet,he,yk14522519_56_0_647_364_0_medium,2025-09-19T03:03:16.307769+00:00
TDads5ITiD1gINpO,https://www.ynet.co.il/news/article/yokra14522305,השופט אלרון קורץ מחומר של עליונים,"צדקו הטוענים שאלרון לא קורץ מ""החומר של העליונים"". כמו גולני, הוא עשוי מחומר טוב יותר, החומר של העם",חדשות,TDads5ITiD1gINpO.jpg,טקס פרישת שופט בית המשפט העליון יוסף אלרון,"צילום: אורן בן חקון, ישראל היום",2025-09-19T00:04:00+03:00,בית המשפט העליון|יוסף אלרון,יובל אלבשן,ynet,he,rJ3rTBKsgl_0_0_1280_721_0_medium,2025-09-19T03:03:16.307809+00:00
vKmsw-UKFAEJGtlW,https://www.haaretz.co.il/opinions/caricatures/2025-09-19/ty-article-opinion/00000199-5ddf-d7ad-a1d9-5dffe18e0000,קריקטורה יומית | 19 בספטמבר 2025,הארץ,דעות|קריקטורה יומית,vKmsw-UKFAEJGtlW.png,איור: ערן וולקובסקי,haaretz,2025-09-19T00:02:29+03:00,,ערן וולקובסקי,haaretz,he,car-19092025,2025-09-19T03:04:06.516612+00:00
AEsp3ixUVhiM5ZpF,https://www.haaretz.co.il/opinions/editorial-articles/2025-09-19/ty-article-opinion/00000199-5d6f-de72-a7fd-7def8a4a0000,הבוננזה של עזה,"תחת הסיסמאות הנבובות הרגילות של ראש הממשלה בנימין נתניהו (""ניצחון מוחלט""), מתחילה להתבהר המטרה האמיתית של המלחמה הנוראה בתולדותינו: נדל""ן. מאות חיילים ורבבות אז",דעות|מאמר מערכת,AEsp3ixUVhiM5ZpF.jpg,"בצלאל סמוטריץ' בכנס התיישבות בחברון, החודש. ראש הממשלה, בנימין נתניהו, טרם הסתייג מתוכנית העיוועים של שר האוצר. צילום: איתי רון",haaretz,2025-09-19T00:02:25+03:00,,מאמר המערכת,haaretz,he,940454-2,2025-09-19T03:04:06.516640+00:00
Ot6qy87gjbNHrq-y,https://www.ynet.co.il/news/article/yokra14520488,"""זה לעניים"": הנתון שחושף את כישלון התחבורה הציבורית בישראל","בזמן שמספר כלי הרכב הפרטיים מזנק - פחות מחמישית מהישראלים משתמשים בקביעות בתחבורה הציבורית. אז למה מה שעובד בחו""ל לא טוב לארץ, מה סטטוס הפרויקטים שכבר שנים כולנו מחכים להם - ולמה אולי בעתיד יהיה פה טוב יותר",חדשות|חדשות בארץ|כללי,Ot6qy87gjbNHrq-y.jpg,הפרוייקטים שישראל מחכה להם,"צילום: נת""ע, shutterstock",2025-09-19T00:01:00+03:00,אוטובוסים|תחבורה ציבורית|רכבות,סיון חילאי,ynet,he,H14KXYtjge_0_0_850_479_0_medium,2025-09-19T03:03:16.307842+00:00
QN52KKXvIwH2ticG,https://www.haaretz.co.il/sport/world-soccer/2025-09-19/ty-article/00000199-5e73-de72-a7fd-7ef33a4f0000,ליגת האלופות: ברצלונה ניצחה את ניוקאסל; 0:2 למנצ'סטר סיטי על נאפולי,צמד של מרכוס ראשפורד העניק לברצלונה ניצחון 1:2 בחוץ ■ נאפולי הפסידה באיתיחאד אחרי שנותרה בעשרה שחקנים בדקה ה-21 ■ קייראט ועופרי ארד הובסו 4:1 בליסבון על ידי ספורטינג,ספורט|כדורגל בעולם,QN52KKXvIwH2ticG.jpg,"מרכוס ראשפורד וז'ול קונדה חוגגים במדי ברצלונה בניצחון על ניוקאסל, אמש. צילום: Jon Super/אי־פי",haaretz,2025-09-19T00:00:21+03:00,,ספורט הארץ,haaretz,he,133622,2025-09-19T03:04:06.516667+00:00
