article_id,guid,title,description,category,image,image_caption,image_credit,pub_date,tags,author,source,language,image_name,fetching_time
ODXdA1izJQz7ayo8,https://www.ynet.co.il/news/article/rjr9qd00jex,"איראן ""לא מוותרת"" לאירופה: ""זה יקרה - הסנקציות הבינלאומיות יחודשו""","מבוי סתום במו""מ בין בריטניה, צרפת וגרמניה לבין איראן, בניסיון לדחות את חידוש הסנקציות הבינלאומיות לפי מנגנון ה-snapback. גורמים באירופה העריכו: חידוש הסנקציות הוא התרחיש הסביר ביותר. גרמניה: ""צריך צעדים קונקרטיים בימים הקרובים כדי שהסנקציות לא יחודשו"". גורם איראני: ""אין סיבה לוותר""",חדשות|חדשות בעולם,ODXdA1izJQz7ayo8.jpg,"מנהיגי בריטניה, צרפת וגרמניה. התרחיש הסביר - סנקציות-ראש ממשלת בריטניה קיר סטרמר, עמנואל מקרון,  פרידריך מרץ",ynet,2025-09-18T00:50:39.026244,"איראן , סבא""א , סנקציות , תוכנית הגרעין , אירופה",,ynet,he,B1Mk3thFgg_0_0_850_479_0_medium,2025-09-17T21:50:39.026244+00:00
6kAD9R0UFN7MHewk,https://www.ynet.co.il/news/article/h1oa9xdoge,"""הכבוד הגדול ביותר"": בריטניה והמלך חיבקו את טראמפ, בלונדון צעקו ""פשיסט!""","בריטניה אירחה את נשיא ארה""ב לביקור רשמי שני - הפעם הראשונה אי-פעם שבה מנהיג זר זוכה לכבוד הזה. המלך צ'רלס ליווה אותו בכרכרה לטירת ווינדזור, סקר עמו משמר כבוד של 1,300 חיילים ושיבח על ""המחויבות לשלום"" במשתה מפואר. כובע הענק של מלניה והמחאה עם דגלי פלסטין: ""לך מכאן, אתה מטנף את הטירה!""",חדשות|חדשות בעולם,6kAD9R0UFN7MHewk.jpg,מלך בריטניה צ,ynet,2025-09-18T00:50:39.026244,"בריטניה , דונלד טראמפ , מלניה טראמפ , המלך צ'רלס , המלכה קמילה",,ynet,he,S1dhsHdolx_0_227_3000_1689_0_medium,2025-09-17T21:50:39.026244+00:00
alP1D2vzR4cDYKM0,https://www.ynet.co.il/news/article/rkjpkouolg,"יועמ""ש המשטרה נגד בן גביר: ""אין עילה למנוע את קידום החוקרת מתיקי נתניהו""","רב-פקד רינת סבן פנתה לבג""ץ לאחר שהשר חתם על קידומה וחזר בו בפתאומיות אחרי עדותה בתיקי האלפים. לפי יועמ""ש המשטרה, אין עילה למנוע את הקידום: ""היא קצינה מצטיינת, ניסיון להציג את הדברים אחרת חוטא לאמת"". לדבריו, ""20% מהקצינים שמונו לסנ""צ בעשור האחרון קיבלו ציון 5 ומטה במרכז ההערכה""",חדשות|חדשות בארץ|משפט ופלילים,alP1D2vzR4cDYKM0.jpg,"המסמך נחשף: בן גביר חתם לרפ""ק סבן על תפקידה כעוזרת ר׳ אח״מ",ynet,2025-09-18T00:50:39.026244,"בג""ץ , משטרה , איתמר בן גביר , משטרת ישראל , מינוי",,ynet,he,SyfF74NLex_0_0_850_479_0_medium,2025-09-17T21:50:39.026244+00:00
xFQu4bb3LzC-2E5q,https://www.ynet.co.il/news/article/ryxptkdole,מהומה סמוך לכלא הצבאי: חסידי גור תקפו חיילים - ומילטו עריק ממעצר,"חיילי המשטרה הצבאית שהובילו כעשרה עריקים לכלא נווה צדק הסמוך לנתניה ספגו אבנים וגז מדמיע, שניים מהם נפצעו באורח קל - והתוקפים הצליחו למלט עריק אחד בחסות המהומה, ואז פצחו בשירה וריקודים. בנו של האדמו""ר מגור תקף ח""כים חרדים: ""תומכים בממשלת הזדון""",חדשות|חדשות בארץ|משפט ופלילים,xFQu4bb3LzC-2E5q.jpg,"בחור ישיבה בן 20, עריק מצה""ל נעצר בנתב""ג-מהומות חרדים בסמוך לכלא 10 בשל מעצר וכליאתם של חרדים עריקים בנתב""ג ",ynet,2025-09-18T00:50:39.026244,"חרדים , הפגנה , מחאה , חסידות גור , חוק הגיוס",,ynet,he,Hye11600Ooex_109_243_666_375_0_medium,2025-09-17T21:50:39.026244+00:00
BhAXcnGv8ssk1Z0I,https://www.ynet.co.il/news/article/sywowd00sxx,"טל ועומר שנרצחו ב-7/10 הובאו לקבורה בכפר עזה: ״ידענו שנחזיר אותך הביתה""","טל אילון ועומר חרמש שבו לקבורה קבועה בקיבוץ - כמעט שנתיים אחרי שנרצחו בטבח 7 באוקטובר. ״הנורא מכל קרה לנו, אני כל כך כועסת עליך שנהרגת, אני כל כך אוהבת אותך״, ספדה אימו של טל. אביו של עומר: ״מי ייתן והרוח שנשבה בך, של אהבת אדם, יושר ונתינה - תהיה נר לרגליי מי שישוב וישקם את הבית שלך״",חדשות|חדשות בארץ|כללי,BhAXcnGv8ssk1Z0I.jpg, עומר וטל. שבו לקבורה בבית- ,ynet,2025-09-18T00:50:39.026244,"קבורה , כפר עזה , טבח 7 באוקטובר , כיתות כוננות",,ynet,he,Bkx0xYdsll_0_0_850_479_0_medium,2025-09-17T21:50:39.026244+00:00
bEpGvIaIPfuRCkiL,https://www.ynet.co.il/news/article/bjwkpidjgx,"אם ו-3 ילדיה אושפזו מהרעלת קנאביס, האב טען: ""הבאתי להם שוקולד שמצאתי""","אם ושלושת ילדיה מתל שבע אושפזו בבית החולים לאחר שצרכו שוקולד שמכיל קנאביס - שקיבלו מאבי המשפחה. האם איבדה הכרה, מצבו של אחד הילדים קשה. האב, שעובד בפינוי אשפה, טען שמצא את השוקולד בעבודה. הוא נעצר בחשד להחזקת סמים והתעללות בקטין, אך שוחרר למעצר בית: ""חשד לא גבוה""",חדשות|חדשות בארץ|משפט ופלילים,bEpGvIaIPfuRCkiL.jpg,אילוס אילוסטרציה קנאביס מריחואנה,ynet,2025-09-18T00:50:39.026244,"סמים , משפחה , תל שבע , הרעלה , קנאביס , בית חולים",,ynet,he,9411072_1_16_1000_563_0_medium,2025-09-17T21:50:39.026244+00:00
5bVAuiwOjRybOiYK,https://www.ynet.co.il/news/article/bkozmwdslg,כשבוע וחצי אחרי תקיפת המתנחלים הקיצונים: המבנים בכפר הפלסטיני נהרסו,"המנהל האזרחי הרס שמונה מבנים בלתי-חוקיים בכפר חלת א-דבע שבדרום הר חברון, יותר משבוע וחצי אחרי שכמה מתושביו הותקפו בידי מתנחלים קיצוניים. לפי מתפ""ש, המבנים ישבו על שטח אש שבו מתאמן צה""ל",חדשות|פוליטי מדיני|צבא וביטחון,5bVAuiwOjRybOiYK.jpg,"מתנחלים תקפו תושבים בכפר חלת אל-דבע, מסאפר יטא",ynet,2025-09-18T00:50:39.026244,"פלסטינים , בנייה לא חוקית",,ynet,he,HkF4beuqgl_0_0_850_479_0_medium,2025-09-17T21:50:39.026244+00:00
5FHvsO7TV1hB65rR,https://www.ynet.co.il/news/article/hjfxe00osxl,"מצוד נרחב במצרים: צמיד זהב של פרעה בן 3,000 שנה נעלם מהמוזיאון","הצמיד, שהיה שייך לפרעה אמנמופֶה ששלט בין 993 ל-984 לפני הספירה, נעלם לפני כמה ימים מהמוזיאון המצרי בקהיר - אך הדבר נשמר עד כה בסוד ""כדי לסייע לחוקרים"". תמונות הצמיד הופצו לפקידים בשדות התעופה, נמלי הים ומעברי הגבול היבשתיים - כדי למנוע את הברחתו ממצרים. אלו התרחישים האפשריים",חדשות|חדשות בעולם,5FHvsO7TV1hB65rR.jpg, ,ynet,2025-09-18T00:50:39.026244,"מצרים , גניבה , ארכיאולוגיה , קהיר , מצרים העתיקה , פרעה , צמידים",,ynet,he,SJuFpu00ixe_0_0_850_479_0_medium,2025-09-17T21:50:39.026244+00:00
wWSVq5duM8I1_mUm,https://www.ynet.co.il/news/article/b1am3poixl,מיליוני דבורים הורעלו למוות באבקה לבנה לפני ראש השנה,"הטרור החקלאי בצפון: מיכאל בדק את 40 הכוורות ליד צבעון שבגליל העליון - ונחרד לגלות שבכל אחת מהן פוזרה אבקה לבנה, ומתחתיה מאות אלפי דבורים מתות: ""נזק נוראי, כאב, תסכול. הדבש הזה אמור היה לעלות על שולחנות החג""",חדשות|חדשות בארץ|משפט ופלילים,wWSVq5duM8I1_mUm.jpg,"״מישהו שלא רוצה לראות כאן חקלאות ישראלית ציונית״-טרור חקלאי נגד הדבוראים הוותיקים של קיבוץ עין חרוד מאוחד שבגלבוע: כ-40 כוורות הושמדו ע""י אלמונים שפיזרו אבקת רעל ",ynet,2025-09-18T00:50:39.026244,"דבורים , חקלאות , גלבוע , הגליל העליון",,ynet,he,rkhy6wdjll_0_592_923_520_0_medium,2025-09-17T21:50:39.026244+00:00
VtCtt7eKN2UUQnW0,https://www.ynet.co.il/news/article/rkrmq00oieg,"הדרך למינוי זיני לראש השב""כ נסללה: זו תשובת היועמ""שית הצפויה לוועדת גרוניס","גלי בהרב-מיארה תציף בפני ועדת גרוניס גם את הבעיות במינוי האלוף דוד זיני - אך לא תמליץ לפסול אותו, ולכן גם צפויה להגן עליו בבג""ץ. חוות דעתה מעלה נושאים שבהם חשש לניגוד עניינים או ספקות בטוהר כוונתו של נתניהו במינוי",חדשות|פוליטי מדיני|המערכת הפוליטית,VtCtt7eKN2UUQnW0.jpg,גלי בהרב מיארה בנימין נתניהו דוד זיני,ynet,2025-09-18T00:50:39.026244,"שב""כ , גלי בהרב-מיארה , דוד זיני",,ynet,he,Hke1etWaZeg_0_0_850_479_0_medium,2025-09-17T21:50:39.026244+00:00
RrA-d2Qocc_ch7r8,https://www.ynet.co.il/news/article/hjzh0d00sge,"נציג של חשוד מרכזי בפרשת מאי גולן: ""הוא לא יהיה עד מדינה""","על אף שהמשטרה ניסתה לגייס שני חשודים פוטנציאליים כעדי מדינה בפרשת ""חגיגות הכספים"", לפי שעה נראה כי המאמץ עלה בתוהו. עורך הדין של אחד מהחשודים המרכזיים טען: ""הוא אמר לי שהחליט להילחם על חפותו""",חדשות|חדשות בארץ|משפט ופלילים,RrA-d2Qocc_ch7r8.jpg,"ח""כ מאי גולן בבית משפט השלום ראשל""צ",ynet,2025-09-18T00:50:39.026244,"משטרה , להב 433 , עד מדינה , משטרת ישראל , מאי גולן",,ynet,he,B1mLBI3rjex_377_182_471_265_0_medium,2025-09-17T21:50:39.026244+00:00
qtpoZMHFHgZ57hnf,https://www.ynet.co.il/news/article/bybekiuieg,"עשרות הרוגים בעיר עזה, האו""ם: מלאי המזון אוזל | תיעודי העקורים נמלטים","פלסטינים עוזבים את עזה בצל הלחימה בעיר, אחרי שצה""ל הודיע על פתיחת נתיב ""מילוט"" דרומה. במקביל, באו""ם ""מודאגים עמוקות"" ממלאי המזון שאוזל לדבריהם בצפון העיר בשל סגירת מעבר זיקים, ובארגון בינלאומי הנאבק בעוני אומרים: ""זו אסטרטגיה"". כ""ץ: ""אם חמאס לא ישחרר את החטופים ויתפרק מנשק - עזה תיחרב""",חדשות|פוליטי מדיני|צבא וביטחון,qtpoZMHFHgZ57hnf.jpg, ,ynet,2025-09-18T00:50:39.026244,"חמאס , צה""ל , עזה , רצועת עזה , פלסטינים , חרבות ברזל",,ynet,he,Hy4nhPuoeg_0_0_850_479_0_medium,2025-09-17T21:50:39.026244+00:00
9bU9cWMQ7HDw6Dj_,https://www.ynet.co.il/news/article/rk00i0xosel,"השקה היסטורית למיירט הלייזר העוצמתי: ""שקלים בודדים להפלת רקטות ומזל""טים""","במשרד הביטחון וברפאל הודיעו כי הגרסה החדשה של ""מגן אור"" תגיע מקו הייצור ותוטמע בחיל האוויר, לקראת כניסתה למבצעיות תחת כיפת ברזל בשנה הבאה: ""זו רק אבן דרך ראשונה, ישראל מובילה מהפכה בשדה הקרב"". היתרון הכלכלי של הפיתוח, והלוחם שנפל בקרב ההירואי בלבנון ושהמערכת החדשה תיקרא על שמו",חדשות|פוליטי מדיני|צבא וביטחון,9bU9cWMQ7HDw6Dj_.jpg,"""ציון דרך היסטורי ברמה עולמית"". מערכת ""אור איתן""-משרד הביטחון וחברת רפאל השלימו את הפיתוח של מערכת ההגנה בלייזר",ynet,2025-09-18T00:50:39.026244,"צה""ל , כיפת ברזל , חיל האוויר , משרד הביטחון , וידאו , רפאל , לייזר , מגן אור",,ynet,he,rJ7P0Eusgx_0_95_1280_721_0_medium,2025-09-17T21:50:39.026244+00:00
35G1C3uZeW-CQvfU,https://www.ynet.co.il/news/article/sjaszn00jex,18 שנים אחרי היעלמות מדלן מקאן: האנס שנחשד ברצח שלה - שוחרר מהכלא,"כריסטיאן ברוקנר, החשוד בפרשת ההיעלמות של הפעוטה הבריטית בנופש בפורטוגל, שוחרר אחרי שהשלים לרצות 7 שנות מאסר בגין פרשה אחרת: אונס קשישה באותו אזור שבו נעלמה מדלן. בבריטניה זימנו אותו לתשאול - והוא סירב",חדשות|חדשות בעולם,35G1C3uZeW-CQvfU.jpg,"מתוך ""מדלן מקאן: המצוד אחרי החשוד המרכזי""",ynet,2025-09-18T00:50:39.026244,"גרמניה , פורטוגל , בריטניה , מדלן מקאן",,ynet,he,ryZHWsk5Cw_0_778_1500_845_0_medium,2025-09-17T21:50:39.026244+00:00
omOUYd8We3JSEHqW,https://www.ynet.co.il/news/article/h1zs4wusge,"הפגנה מול בית רה""מ, אמו של מתן אנגרסט לשרה נתניהו: ״אישן כאן ברחוב, רדי אליי״","בפעם השנייה מתחילת הפעולה הקרקעית בעזה, ובלילה השלישי במקום, מפגינים התאספו מול מעון ראש הממשלה בירושלים בדרישה להסכם שחרור 48 החטופים. ענת אנגרסט, אמו של מתן, שלחה הודעת ווטסאפ לרעיית רה״מ: ""כאמא לאמא, רדי"". אביו של גיא אילוז: ״נילחם על הילדים, נקים עיר אוהלים, נעשה פה מצור״",חדשות|חדשות בארץ|כללי,omOUYd8We3JSEHqW.jpg, ,ynet,2025-09-18T00:50:39.026244,"שרה נתניהו , ירושלים , הפגנה , חטופים , מעון ראש הממשלה , עסקת חטופים",,ynet,he,rJhJUwdogg_0_0_850_479_0_medium,2025-09-17T21:50:39.026244+00:00
A8uPAkDnocYsgn37,https://www.ynet.co.il/news/article/hywxgpdjlx,"בכיר חמאס הופיע לראשונה מאז ההפצצה בקטאר: ""12 טילים פגעו תוך דקה - ושרדנו""","הבכיר השני שמופיע באל-ג'זירה: ראזי חמד טען כי צמרת ארגון הטרור שהתכנסה בדוחא שמעה את הפיצוצים והספיקה לברוח. הוא תקף את התיווך של ארה""ב (""ניסיון מר""), וקרא למדינות ערב לעמוד בחזית אחת נגד ישראל",חדשות|פוליטי מדיני|צבא וביטחון,A8uPAkDnocYsgn37.jpg,"ראזי חמד באל-ג-בכיר חמאס, ראזי חמד, שהיה יעד לחיסול בקטר, מתראיין לערוץ אלג’זירה",ynet,2025-09-18T00:50:39.026244,"חמאס , עזה , קטאר , רצועת עזה , תקיפה , דוחא , מבצע פסגת האש",,ynet,he,rkgLfwOsel_0_0_1231_683_0_medium,2025-09-17T21:50:39.026244+00:00
STub7lzTQAa-7U3J,https://www.ynet.co.il/news/article/hypmsv00ole,"סולברג ללוין: ""המשפט הישראלי רחוק מלהיות מושלם""","ברקע המתיחות בינו לבין נשיא העליון והיועמ""שית, נאם שר המשפטים בטקס פתיחת שנת המשפט שנערך בלשכת עורכי הדין בי-ם: ""השיח הפך לקיצוני ומתלהם. ההתערבות השיפוטית מעמיקה את המשבר"". השופט סולברג: ""חובה לתקן ולעשות שינויים - אבל בדרכי שלום""",חדשות|חדשות בארץ|משפט ופלילים,STub7lzTQAa-7U3J.jpg,"""להביע ביקורת מתוך אהבה"". השופט סולברג-טקס השבעת 35 שופטים חדשים בבית הנשיא",ynet,2025-09-18T00:50:39.026244,"בית המשפט העליון , וידאו , יריב לוין , לשכת עורכי הדין , מערכת המשפט , נעם סולברג",,ynet,he,rJFUxXSCyx_0_0_1280_854_0_medium,2025-09-17T21:50:39.026244+00:00
mTlTBJhzocgFC23c,https://www.ynet.co.il/news/article/hylldvujxg,השביעית בישראל: מדינת האיים שפתחה שגרירות בירושלים,"פיג'י שבדרום האוקיינוס השקט, עם פחות ממיליון תושבים, הצטרפה לרשימת המדינות להן שגרירויות בעיר הבירה. בטקס החניכה השתתפו ראש הממשלה נתניהו ושר החוץ סער, יחד עם ראש ממשלת פיג'י סטינבני ראבוקה. עלויות השכרת המבנה - במימון משרד החוץ",חדשות|פוליטי מדיני|מדיני,mTlTBJhzocgFC23c.jpg,טקס פתיחת שגרירות פיג,ynet,2025-09-18T00:50:39.026244,"פרגוואי , ירושלים , שגרירים",,ynet,he,SyZAIE00ige_254_321_850_479_0_medium,2025-09-17T21:50:39.026244+00:00
5iy35Sb76BbXYup-,https://www.ynet.co.il/news/article/bknqbsuoxl,"העזתים שמבקשים לעזוב: ""תוציאו אותנו - ואז תעשו מה שבא לכם""","מתאם פעולות הממשלה בשטחים שיתף תגובות של עזתים בפייסבוק שביקשו לעזוב את הרצועה. ""אפשר להגיש בקשה ולוותר על כל עזה? איך זה עובד?"", כתב אחד מהם. אלוף רסאן עליאן פנה לתושבי הרצועה: ""נמשיך לתאם פינויים נוספים""",חדשות|פוליטי מדיני|צבא וביטחון,5iy35Sb76BbXYup-.jpg,אינפוגרפיקה עם תגובתיהם של תושבי עזה על צביעות מנהיגי חמאס שמנסים  לצאת מהרצועה,ynet,2025-09-18T00:50:39.026244,"רצועת עזה , מתאם הפעולות בשטחים , חרבות ברזל",,ynet,he,HkCPZrdoel_0_129_771_435_0_medium,2025-09-17T21:50:39.026244+00:00
x3CHQTrAYeL3j3pb,https://www.ynet.co.il/news/article/s1zibv00igl,"שיקלי: ""אסור לישראלים להיות בקשר עם קטאר, זו מדינת אויב מצורעת""","שר התפוצות והמאבק באנטישמיות האשים את קטאר בפגיעה בישראל בזירה הבינלאומית, ואמר בריאיון לאולפן ynet כי ""יש פה ציר רשע חדש"". הוא קרא ליהודי העולם להגיע לישראל בצל העלייה באנטישמיות, והזהיר: ""הקטארים קנו חצי מלונדון. בלגיה כבר גמורה. אירופה תיכבש בהגירה""",חדשות|פוליטי מדיני|המערכת הפוליטית,x3CHQTrAYeL3j3pb.jpg,"השר עמיחי שיקלי בביהמ""ש המחוזי בלוד - דיון הארכת מעצרו של איש שב""כ החשוד שהדליף מידע סודי לעיתונאים ולשר שיקלי",ynet,2025-09-18T00:50:39.026244,"בלגיה , צרפת , קטאר , בריטניה , אנטישמיות , יהדות התפוצות , עמיחי שיקלי",,ynet,he,H1QUcUpiC1x_110_29_1109_624_0_medium,2025-09-17T21:50:39.026244+00:00
0rMgp_Q30bUFjTLW,https://www.ynet.co.il/news/article/sjfwyedjlx,"המשטרה: חזרת אוריך ללשכת רה""מ - פרצה הקוראת לגנב; הוא יעשה הרבה בשביל כסף","אחרי שנשיא בית משפט השלום בראשון לציון דחה את בקשת המשטרה להאריך את הרחקת יועצו של ראש הממשלה מעבודה בלשכה, הגישה המשטרה ערעור למחוזי: ""המקום הכי רגיש במדינה, לא ייתכן שיגיעו אליו מסמכים סודיים"". עורך דינו חדד: ""כתב החשדות עלוב, יש פה עוול גדול"". ההחלטה הסופית - במועד אחר",חדשות|חדשות בארץ|משפט ופלילים,0rMgp_Q30bUFjTLW.jpg,מחוזי לוד: ערעור המשטרה בעניין יונתן אוריך,ynet,2025-09-18T00:50:39.026244,"וידאו , בית המשפט , פרשת המסמכים הסודיים , פרשת קטאר-גייט , יונתן אוריך , עמית חדד",,ynet,he,B1sAE8usxl_0_44_1280_721_0_medium,2025-09-17T21:50:39.026244+00:00
0mwyEVCyXOwRCyb4,https://www.ynet.co.il/news/article/sywiy4djlx,"סמוטריץ': עזה - בוננזה של נדל""ן, דנים עם ארה""ב איך נחלק אחוזים על הקרקע","שר האוצר אישר לראשונה כי התוכנית האוטופית לשיקום רצועת עזה, שנחשפה ב-ynet ודווח ש""מסתובבת"" גם בממשל טראמפ, נמצאת בדיונים עם האמריקנים - והסביר: ""שילמנו הרבה כסף על המלחמה, צריך לעשות אחוזים על הקרקע. את שלב ההריסה כבר עשינו""",חדשות|פוליטי מדיני|המערכת הפוליטית,0mwyEVCyXOwRCyb4.jpg, ,ynet,2025-09-18T00:50:39.026244,"עזה , רצועת עזה , ארצות הברית , וידאו , שר האוצר , בצלאל סמוטריץ'",,ynet,he,rJ11XcSdjxg_0_0_850_479_0_medium,2025-09-17T21:50:39.026244+00:00
HgTf-XdNMnwFT3SI,https://www.ynet.co.il/news/article/bjqq6fosgg,"בעזרת משרד רה""מ: מיליון שקלים יוקצו למחזה חנוכה לחיזוק זהות לאומית-יהודית","משרד ראש הממשלה יממן מחצית מתקציב המחזה החדש ""בראשית"", שיעלה לבקשת ח""כ אבי מעוז ויציג את ציר הזמנים של עם ישראל בארץ. במהלך המופע החדש יחולקו לצופים דפי הסבר, מטרתו: חיזוק הזהות הלאומית היהודית",חדשות|חדשות בארץ|כללי,HgTf-XdNMnwFT3SI.jpg,אבי מעוז,ynet,2025-09-18T00:50:39.026244,"חנוכה , בנימין נתניהו , תקציב , אבי מעוז",,ynet,he,BJuAXTChLn_0_135_1300_732_0_medium,2025-09-17T21:50:39.026244+00:00
2MvwBu-ev2oQPr5K,https://www.ynet.co.il/news/article/s1esob00sgx,"המספרים המדאיגים של רצח נשים בנשק חם: ""בקצב הזה נגיע לזינוק של 100%""",מספר הנרצחות השנה ביריות טיפס ל-12 עם מותה מירי של וופא אבו גאנם ברמלה. בחודשים האחרונים נרשמו כמה מקרים מזעזעים של רצח נשים בידי בני זוגן. קואליציית ארגוני הנשים דורשת לפעול - זאת בזמן שהממשלה מקדמת הקלות בחלוקת ואחזקת נשקים. בין ההצעות: הגברת השימוש באזיק אלקטרוני,חדשות|חדשות בארץ|משפט ופלילים,2MvwBu-ev2oQPr5K.jpg,-הזירה ברמלה,ynet,2025-09-18T00:50:39.026244,"אלימות במשפחה , אלימות נגד נשים , רצח , וידאו , נשק , אזיק אלקטרוני , רצח נשים",,ynet,he,r1bUWc0Psee_0_142_3000_1688_0_medium,2025-09-17T21:50:39.026244+00:00
oc0Zb3Qhfin_Y1au,https://www.ynet.co.il/news/article/s1juq11oixg,האזהרות שנתניהו העדיף לשכוח: כך צועדת ישראל לבידוד מוחלט בזירה הבינלאומית,"ראש הממשלה בחר פעם אחר פעם בשותפיו הקיצוניים לקואליציה על פני התמודדות עם המצב הבינלאומי - וישראל דוהרת לבידוד חסר תקדים, שעלול להחמיר גם את המצב הביטחוני. שר החוץ הזהיר ש""עזה תמשוך אותנו למטה"", מדינות המפרץ מאותתות על פירוק אפשרי של הסכמי השלום וגם בארה""ב גוברים הקולות המתנגדים לישראל. מאחורי ההפסד של ישראל במלחמת התודעה",חדשות|פוליטי מדיני|מדיני,oc0Zb3Qhfin_Y1au.jpg,"הפגנת נגד ישראל לונדון, טראמפ, נתניהו, מקרון, סטרמר ",ynet,2025-09-18T00:50:39.026244,"עזה , האיחוד האירופי , ירדן , מצרים , צרפת , קטאר , בנימין נתניהו , רצועת עזה , איחוד האמירויות הערביות , ארצות הברית , איתמר בן גביר , בצלאל סמוטריץ' , חרבות ברזל",,ynet,he,BkN6EjUPxx_0_0_850_479_0_medium,2025-09-17T21:50:39.026244+00:00
