article_id,guid,title,description,category,image,image_caption,image_credit,pub_date,tags,author,source,language,image_name,fetching_time
w894kChDr7ChiUjn,https://www.haaretz.co.il/opinions/2025-09-20/ty-article-opinion/.premium/00000199-5d26-de72-a7fd-7de736190000,"""למי שאינו מאמין קשה לחיות השנה"", כתבה לאה גולדברג. היום למאמין קשה יותר","באחרונה הנחינו שיח לוחמים בכנס השנתי של השמאל האמוני. במפגש השתתפו חיילים וחיילות מבתים דתיים וחרדיים, שכמונו שירתו בצה""ל מאז 7 באוקטובר. הסיפור של כל אחד מהמיל",דעות,w894kChDr7ChiUjn.jpg,"הצהרת משפחות חטופים, הערב מול בית רה""מ. צילום: אוליבייה פיטוסי",haaretz,2025-09-20T20:00:00+03:00,,אביעד הומינר רוזנבלום,haaretz,he,140255,2025-09-20T18:12:12.229591+00:00
j2xWQ1twLvu8toki,https://www.haaretz.co.il/opinions/2025-09-20/ty-article-opinion/.premium/00000199-5d6b-de72-a7fd-7deb42440000,נתניהו יצליח להקים ספרטה רק אם נהיה ספרטנים. אז נסרב להיות,"עינב צנגאוקר הכריזה מלחמה על ממשלת ישראל. עלינו להצטרף אליה. למעשה, לא ברור מדוע לא יצאנו למלחמה הזאת מזמן, למה אפשרנו לממשלת נתניהו להחריב חלקים כה רבים מרצועת",דעות,j2xWQ1twLvu8toki.jpg,"הצהרת משפחות חטופים, הערב מול בית רה""מ. צילום: אוליבייה פיטוסי",haaretz,2025-09-20T20:00:00+03:00,,דרור משעני,haaretz,he,129592,2025-09-20T18:12:12.229625+00:00
DDxFlwnvaWkpGh8s,https://www.haaretz.co.il/opinions/2025-09-20/ty-article-opinion/.premium/00000199-5d0f-de72-a7fd-7dcf24810000,לא הפנו אלינו אנטישמיות בשוודיה ובדנמרק. רק הרבה שאלות על מה קרה לישראל,"השוודים מודאגים. ממה הם מודאגים? בעיקר ממה שקורה באוקראינה ומזה שפוטין עושה מה שמתחשק לו שם. הם חוששים שגם תורם יגיע מתישהו. גם הצטרפותם לנאט""ו גורמת לרבים מהם",דעות,DDxFlwnvaWkpGh8s.jpg,"הצהרת משפחות חטופים, הערב מול בית רה""מ. צילום: אוליבייה פיטוסי",haaretz,2025-09-20T20:00:00+03:00,,עלית קרפ,haaretz,he,823572,2025-09-20T18:12:12.229655+00:00
6grIUDeZwLxlGHHO,https://www.haaretz.co.il/opinions/letters/2025-09-20/ty-article-opinion/.premium/00000199-5ce6-d0dc-afdb-def7da8d0000,ההיסטוריה לא תסלח | 21.9.2025,"התגובה על ""חרטוט הוא הדרך היחידה שנתניהו מכיר להבטחת שלטונו"", מאת סמי פרץ (""הארץ"", 10.9)",דעות|מכתבים למערכת,,,haaretz,2025-09-20T20:00:00+03:00,,הארץ,haaretz,he,,2025-09-20T18:12:12.229686+00:00
2CS__inPOVfTyP7V,https://www.haaretz.co.il/opinions/letters/2025-09-20/ty-article-opinion/.premium/00000199-5d01-d0dc-afdb-dfb7e8df0000,קיר הברזל הוא רק שלב,"בתגובה על ""נתניהו הודה כי ישראל נמצאת בצרה והצהיר: 'נהיה סופר־ספרטה'"", מאת נתי טוקר, ליזה רוזובסקי ויהונתן ליס (""הארץ"", 15.9)",דעות|מכתבים למערכת,2CS__inPOVfTyP7V.jpg,"הצהרת משפחות חטופים, הערב מול בית רה""מ. צילום: אוליבייה פיטוסי",haaretz,2025-09-20T20:00:00+03:00,,יגאל רינת,haaretz,he,3308509565,2025-09-20T18:12:12.229714+00:00
jmKQnPv3nGvo_p9m,https://www.haaretz.co.il/news/politics/2025-09-20/ty-article/.premium/00000199-658b-de72-a7fd-6dcbad330000,עמותה חילקה לחיילים באזורי לחימה חוברות צביעה עם ציורי עזה ההרוסה וההתנתקות,"בחוברת של עמותת ""תודה לצה""ל"" נכתב לקרובי החיילים כי מאז 7 באוקטובר הם ""עוברים תקופה מדהימה - אבל גם לא פשוטה"". בין היתר מופיעים בה ציור של שלט עם הכיתוב ""שנית כפר דרום לא יפול"" ושל חיילים ודחפורים לצד שלט שעליו הכתובת ""I Love Gaza""",חדשות|מדיני ביטחוני,jmKQnPv3nGvo_p9m.jpeg,"הצהרת משפחות חטופים, הערב מול בית רה""מ. צילום: אוליבייה פיטוסי",haaretz,2025-09-20T19:30:11+03:00,,יניב קובוביץ,haaretz,he,whatsapp-image-2025-09-19-at-13-49-56,2025-09-20T18:12:12.229752+00:00
a8NZJh021a6UywfF,https://www.haaretz.co.il/news/politics/2025-09-20/ty-article/.premium/00000199-6790-daaf-a79f-eff682280000,מקור מצרי: נתניהו ביקש מטראמפ לעצור את ההתעצמות הצבאית המצרית בסיני,"לפי מקורות מצריים ודיפלומטיים, בקהיר חושדים שבקשת נתניהו נועדה לאפשר טרנספר של תושבים מעזה לסיני. ""למצרים אין כוונות התקפיות, והיא רואה בשלום עם ישראל נכס אסטרטגי"", הבהיר אחד מהם. ""הדאגה העיקרית שלה היא שפלסטינים יעקרו בכפייה לשטחה""",חדשות|מדיני ביטחוני,a8NZJh021a6UywfF.webp,"הצהרת משפחות חטופים, הערב מול בית רה""מ. צילום: אוליבייה פיטוסי",haaretz,2025-09-20T19:08:20+03:00,,ליזה רוזובסקי,haaretz,he,662591,2025-09-20T18:12:12.229788+00:00
U0G0Mx3CykMAMnrW,https://www.haaretz.co.il/news/world/africa/2025-09-20/ty-article/.premium/00000199-67bf-de72-a7fd-6fffc4680000,"המורדים בסודאן שיגרו טיל מכטב""ם לעבר מסגד הומה מתפללים בעיר הנצורה אל־פאשר, עשרות בני אדם נהרגו","לפחות 84 גופות חולצו מהריסות המסגד, בהם נשים וילדים. בין ההרוגים רופא שרק בשבוע שעבר סיפר לניו יורק טיימס על המצור האכזרי שמטילה מיליציית ""כוחות ההתערבות המהירה"" על כ־260 אלף אזרחים באל־פאשר, שנמשך 18 חודשים",חדשות|חדשות - אפריקה,U0G0Mx3CykMAMnrW.jpg,"תושבים מאל־פאשר במחנה עקורים באל דבה, סודאן, החודש. צילום: El Tayeb Siddig/רויטרס",haaretz,2025-09-20T18:58:25+03:00,,ניו יורק טיימס,haaretz,he,025142-2,2025-09-20T18:12:12.229817+00:00
vmXR1F1N6wwECk0i,https://www.haaretz.co.il/gallery/dance/review/2025-09-20/ty-article-review/.premium/00000199-67a8-dc39-abbf-6fe877b40000,"המופע ""גוף ענק שקוף"" מאפשר להימלט מהמציאות, שמבצבת פה ושם","מופע המחול ""גוף ענק שקוף"" שיצרה בשמת נוסן עוסק בפער שבין אנושיות לחומריות. הקהל מוזמן לצאת ולהיכנס מחלל האירוע, לקבוע בעצמו כמה לצלול לחוויה",תרבות|ביקורת מחול,vmXR1F1N6wwECk0i.jpg,"עדי ואסי בוזגלו ב""בוזגלוס: הקרב על הירושה"". הלעג העצמי מנוגד לפן הכי פחות נעים בסרט — ממד היוהרה. צילום: JUDA KHATIAPSUTURI / סרטי יונייטד קינג",haaretz,2025-09-20T18:50:01+03:00,,רן בראון,haaretz,he,63126006,2025-09-20T18:12:12.229845+00:00
XOTLywXNzSebUU9c,https://www.haaretz.co.il/sport/other/2025-09-20/ty-article-magazine/.premium/00000199-6765-da3e-a7dd-ff7debdf0000,"הרצות הקנייתיות פורחות באליפות העולם, ועוקפות את הגברים בסיבוב","זכייתה של ביאטריס צ'בט במקצה ה-5,000 מטר היתה החותם הסופי על ההצלחה העצומה של הרצות מקניה. מי שבעבר חסו בצילם של הגברים, כיום מובילות בגאון את המשלחת ■ אנה הול היתה כוכבת עולה בקרב שבע. עכשיו היא כבר אלופת עולם",ספורט|ענפים נוספים,XOTLywXNzSebUU9c.jpg,"ביאטריס צ'בט (מימין) ופיית' קיפייגון הקנייתיות חוגגות את המקום הראשון והשני בריצת 5,000 מטר, היום. הסגנית מאורגון ובעלת הארד מבודפשט היא עתה אלופת העולם. צילום: Matthias Schrader/אי־פי",haaretz,2025-09-20T18:27:58+03:00,,עוזי דן,haaretz,he,153884,2025-09-20T18:12:12.229873+00:00
3AJ8InlihI7VdVG-,https://www.haaretz.co.il/news/politics/2025-09-20/ty-article/.premium/00000199-672f-daaf-a79f-ef7faa680000,"ענת אנגרסט: אייל זמיר, איזה מין מפקד אתה? חייל של נתניהו ששולח את פקודיו למלכודות מוות?",העצרות המרכזיות למען החטופים יערכו בכיכר פריז בירושלים ב־20:30 וברחבת מוזיאון תל אביב ב־20:00. קודם לכן קרובי חטופים ימסרו הצהרה במאהל המחאה שהקימו ליד בית ראש הממשלה בירושלים,חדשות|מדיני ביטחוני,3AJ8InlihI7VdVG-.jpg,טראמפ לקראת המראתו חזרה לוושינגטון לאחר הביקור בלונדון. צילום: AFP/ANDREW CABALLERO-REYNOLDS,haaretz,2025-09-20T17:46:41+03:00,,בר פלג,haaretz,he,108241,2025-09-20T15:03:59.768392+00:00
qMYWe3Z7ic4EGqiE,https://www.haaretz.co.il/news/politics/2025-09-20/ty-article/.premium/00000199-672f-daaf-a79f-ef7faa680000,"אלפים מפגינים ברחבי הארץ; אחיו של נמרוד כהן לראשי מערכת הביטחון: לא תוכלו להגיד ""רק ביצעתי פקודות""","העצרות המרכזיות למען החטופים נערכות בכיכר פריז בירושלים וברחבת מוזיאון תל אביב. ענת אנגרסט, אימו של החייל החטוף מתן: ""זמיר, איזה מין מפקד אתה? חייל של נתניהו ששולח את פקודיך למלכודות מוות?""",חדשות|מדיני ביטחוני,qMYWe3Z7ic4EGqiE.jpg,"כיכר החטופים בתל אביב, הערב. צילום: איתי רון",haaretz,2025-09-20T17:46:41+03:00,,בר פלג,haaretz,he,158007,2025-09-20T18:12:12.229899+00:00
a9wuWX1du_8JZm_q,https://www.haaretz.co.il/news/politics/2025-09-20/ty-article/.premium/00000199-672f-daaf-a79f-ef7faa680000,"אלפים הפגינו ברחבי הארץ; אחיו של נמרוד כהן לראשי מערכת הביטחון: לא תוכלו להגיד ""רק ביצעתי פקודות""","העצרות המרכזיות למען החטופים נערכו בכיכר פריז בירושלים וברחבת מוזיאון תל אביב. פדוי השבי יאיר הורן נאם בדמעות בעצרת בירושלים: רצנו במנהרות והתחמקנו מגזים רעילים. אני שרדתי וחזרתי בעסקה, וזו כנראה הדרך היחידה להחזיר את כל החטופים",חדשות|מדיני ביטחוני,a9wuWX1du_8JZm_q.jpg,"כיכר החטופים בתל אביב, הערב. אביו של החטוף תמיר נמרודי לנתניהו: ""אתה ויתרת על הבת שלך. אנחנו לא נוותר על הילדים שלנו"". צילום: איתי רון",haaretz,2025-09-20T17:46:41+03:00,,בר פלג,haaretz,he,158007,2025-09-20T21:04:12.206471+00:00
C8TmBSyEewNcY0MN,https://www.haaretz.co.il/gallery/music/2025-09-20/ty-article/.premium/00000199-673c-da3e-a7dd-ff3c02c20000,"סין, הודו וקטאר יתמודדו הערב בגרסה המתחרה של רוסיה לאירוויזיון","לאחר שהנשיא פוטין הכריז על חזרתו של האינטרוויזיון, שפעל בשנות ה-60 עד שנות ה-80, הערב יתחרו בתחרות 23 מדינות - רובן בעלות בריתה של רוסיה. השתתפות רוסיה באירוויזיון נאסרה בשנת 2022",תרבות|מוזיקה,C8TmBSyEewNcY0MN.jpg,אבישי בן ארוש. אחרי 325 ימי מילואים החליט שהוא לא יכול עוד. צילום: אורית פניני,haaretz,2025-09-20T17:44:53+03:00,,גרדיאן,haaretz,he,369004,2025-09-20T15:03:59.768483+00:00
ML8QqzRtVKkvvcY-,https://www.haaretz.co.il/news/world/asia/2025-09-20/ty-article-magazine/.premium/00000199-676e-daaf-a79f-ef7e476e0000,"אחרי שהפך אוניברסיטאות באפגניסטאן למקום לגברים בלבד, טליבאן אוסר בהן ספרים שנכתבו על ידי נשים","יותר מ־600 ספרים, רבים מהם פרי עטן של נשים, הוצאו מתוכניות הלימוד וגם נאסר על קיום קורסים על זכויות אדם, דמוקרטיה ונשים: ""הצעד משקף דפוס של הדרה של נשים מכל תחום בחיים, זה ניסיון להשמיד את ההיסטוריה של חייהן""",חדשות|חדשות – אסיה ואוקיאניה,ML8QqzRtVKkvvcY-.jpg,"תלמידות במרכז לימודי דת בקאבול, במאי. צילום: Ebrahim Noroozi/אי־פי",haaretz,2025-09-20T17:36:33+03:00,,ניו יורק טיימס,haaretz,he,529916-2,2025-09-20T15:03:59.768522+00:00
kHpgCRHA1fshkuNj,https://www.haaretz.co.il/gallery/2025-09-20/ty-article/.premium/00000199-6745-daaf-a79f-ef77235c0000,השחקן והזמר אריה מוסקונה מת בגיל 78,מוסקונה השתתף בסרטים רבים ובסדרות טלוויזיה וזכה בשני פרסי אופיר. הוא מת לאחר מאבק במחלת ריאות כרונית,תרבות,kHpgCRHA1fshkuNj.jpg,אבישי בן ארוש. אחרי 325 ימי מילואים החליט שהוא לא יכול עוד. צילום: אורית פניני,haaretz,2025-09-20T16:32:29+03:00,,טליה בנון צור,haaretz,he,610007-3,2025-09-20T15:03:59.768560+00:00
C1l8AavHXkenPMoS,https://www.haaretz.co.il/sport/world-soccer/2025-09-20/ty-article/00000199-673a-dc39-abbf-6f7ab60c0000,ליברפול ניצחה את אברטון 1:2 ונותרה מושלמת בפרמייר-ליג; אלכסנדר איסק ערך הופעת בכורה בליגה,"ליברפול שמרה על המקום הראשון בפרמייר-ליג לאחר שגברה על אברטון 1:2 בדרבי המרסיסייד. ראיין חראפנברך (10) והוגו אקיטיקה (29) כבשו עבור האדומים, אידריסה גיי (58) רק צימק. אלכסנדר איסק ערך הופעת בכורה בליגה",ספורט|כדורגל בעולם,C1l8AavHXkenPMoS.jpg,"ראיין חראפנברך (שני מימין) חוגג עם שחקני ליברפול, היום. צילום: Rui Vieira/אי־פי",haaretz,2025-09-20T16:28:53+03:00,,ספורט הארץ,haaretz,he,152671,2025-09-20T15:03:59.768591+00:00
UKtKqTAR0YQq044P,https://www.haaretz.co.il/sport/world-soccer/2025-09-20/ty-article/00000199-673a-dc39-abbf-6f7ab60c0000,ליברפול ניצחה את אברטון 1:2 ונותרה מושלמת בפרמייר-ליג; מנצ'סטר יונייטד ניצחה את צ'לסי 1:2,"ליברפול שמרה על המקום הראשון בפרמייר-ליג לאחר שגברה על אברטון 1:2 בדרבי המרסיסייד. מנצ'סטר יונייטד ניצלה כרטיס אדום מוקדם לשוער צ'לסי כדי לנצח 1:2 באולד טראפורד, טוטנהאם הוטספר חזרה מפיגור כפול וחילצה 2:2 אצל ברייטון",ספורט|כדורגל בעולם,UKtKqTAR0YQq044P.jpg,"ראיין חראפנברך (שני מימין) חוגג עם שחקני ליברפול, היום. צילום: Rui Vieira/אי־פי",haaretz,2025-09-20T16:28:53+03:00,,ספורט הארץ,haaretz,he,152671,2025-09-20T21:04:12.206574+00:00
dxdE5OgjapSTHok7,https://www.haaretz.co.il/news/world/europe/2025-09-20/ty-article/.premium/00000199-672f-d9a3-a7dd-67efda930000,"""מוסקבה בודקת גבולות"": מטוסי קרב רוסיים חדרו למרחב האווירי של אסטוניה במשך 12 דקות","אסטוניה גינתה את הפרת המרחב האווירי שלה, יותר משבוע לאחר ש-21 כטב""מים רוסיים חדרו לשטח פולין, וזימנה את ממלא מקום השגריר הרוסי כדי להביע מחאתה: ""צעד חצוף וחסר תקדים, זו הוכחה ברורה להסלמה ההולכת וגוברת מצד רוסיה"". במקביל, לפחות שלושה בני אדם נהרגו ועשרות נפצעו במתקפת טילים וכטב""מים רוסית בשטח אוקראינה",חדשות|אירופה,dxdE5OgjapSTHok7.jpg,"מבנה הפנטגון, ב-2020. דובר הפנטגון נמנע לומר מדוע ההנחיות פורסמו כעת או אם הבית הלבן היה מעורב בהחלטה ליישמן. צילום: Carlos Barria/רויטרס",haaretz,2025-09-20T16:25:57+03:00,,ניו יורק טיימס,haaretz,he,145352,2025-09-20T15:03:59.768625+00:00
eVzn1k3ZwrierXqw,https://www.haaretz.co.il/news/weather/2025-09-20/ty-article/00000199-6724-daaf-a79f-ef76b09b0000,"תחזית ליום ראשון: בהיר, עלייה קלה בטמפרטורות וחם מהרגיל לעונה","מזג האוויר מחר (ראשון) יהיה בהיר, עם עלייה קלה בטמפרטורות. יהיה חם ויבש מהרגיל לעונה, ואחר הצהריים רוחות צפוניות ערות ינשבו לאורך מישור החוף. הים התיכון יהיה גל",חדשות|מזג האוויר,eVzn1k3ZwrierXqw.jpg,"פריחת חצבים בעוטף עזה, אתמול. צילום: אליהו הרשקוביץ",haaretz,2025-09-20T16:22:40+03:00,,הארץ,haaretz,he,139954,2025-09-20T15:03:59.768658+00:00
1hPPb08mCAkt5xkc,https://www.haaretz.co.il/news/weather/2025-09-20/ty-article/00000199-6724-daaf-a79f-ef76b09b0000,"תחזית מזג האוויר: בהיר, עלייה קלה בטמפרטורות וחם מהרגיל לעונה","השירות המטארולוגי מסר כי בימים הקרובים הטמפרטורות יעלו ויתפתחו תנאי שרב, כשהשיא יהיה ביום שלישי. ביום חמישי ירדו הטמפרטורות בין 8 ל־10 מעלות, ואף ייתכן גשם",חדשות|מזג האוויר,1hPPb08mCAkt5xkc.jpg,"פריחת חצבים בעוטף עזה, אתמול. צילום: אליהו הרשקוביץ",haaretz,2025-09-20T16:22:40+03:00,,ניר חסון,haaretz,he,139954,2025-09-21T00:46:03.083518+00:00
agNTe1iNUVkdeYcs,https://www.haaretz.co.il/debate/2025-09-20/ty-article-opinion/.free/00000199-66f1-dc39-abbf-6ef11d900000,وكأنّه منذ بداية الصهيونية لم نستطع أن نتخيّل شيئاً آخر سوى اختفائهم,"قبل أسبوع ونصف، أصدر الناطق باسم الجيش الإسرائيلي بياناً موجهاً إلى سكان شمال القطاع قال فيه: ""إخلاء مدينة غزة لا مفر منه"" — وكأنّ الأمر قضاء سماوي أو قدر محتوم",هآرتس بالعربي,agNTe1iNUVkdeYcs.jpg,غزّة، في الشهر الماضي. وكأنّه منذ بدايات الصهيونية لم نستطع أن نتخيّل سوى اختفاء الفلسطينيين. צילום: AFP/OMAR AL-QATTAA,haaretz,2025-09-20T14:54:27+03:00,,حجاي إلعاد,haaretz,ar,62908847,2025-09-20T12:16:45.817756+00:00
Z0Ot_EMPSOrhug9P,https://www.haaretz.co.il/news/politics/2025-09-20/ty-article/00000199-66d8-de72-a7fd-6edb37d20000,"דיווחים בעזה: יותר מ-50 הרוגים בתקיפות מהבוקר, בהם בני משפחתו של מנהל בית החולים שיפא","מקורות רפואיים מסרו כי 43 בני אדם נהרגו בעיר עזה מהבוקר, ולפי דיווחים בני משפחתו של מנהל בית החולים שיפא ביניהם. משרד ההסברה ברצועה דיווח שכ-22,000 חזרו לעיר עזה בשל מחסור בתשתיות באזור ההומניטרי",חדשות|מדיני ביטחוני,Z0Ot_EMPSOrhug9P.jpg,"עקורים מהעיר עזה במחנה הפליטים נוסייראת, אתמול. צילום: AFP/EYAD BABA",haaretz,2025-09-20T14:28:12+03:00,,ג'קי חורי,haaretz,he,140217,2025-09-20T12:16:45.817841+00:00
D_9hMx-PitMkI0SK,https://www.haaretz.co.il/news/politics/2025-09-20/ty-article/00000199-66d8-de72-a7fd-6edb37d20000,"דיווחים בעזה: יותר מ־50 הרוגים בתקיפות מהבוקר, בהם בני משפחתו של מנהל בית החולים שיפא","מקורות רפואיים מסרו כי 43 בני אדם נהרגו בעיר עזה מהבוקר, בהם יותר מעשרה קרובי משפחה. משרד ההסברה ברצועה דיווח שכ-22,000 תושבים שעזבו את העיר עזה חזרו אליה בשל מחסור בתשתיות באזור ההומניטרי במואסי",חדשות|מדיני ביטחוני,D_9hMx-PitMkI0SK.jpg,"עקורים מהעיר עזה במחנה הפליטים נוסייראת, אתמול. צילום: AFP/EYAD BABA",haaretz,2025-09-20T14:28:12+03:00,,ג'קי חורי,haaretz,he,140217,2025-09-20T15:03:59.768735+00:00
iJUsmqJBtgOXwEtm,https://www.haaretz.co.il/news/politics/2025-09-20/ty-article/00000199-66d8-de72-a7fd-6edb37d20000,"משרד הבריאות בעזה: 79 נהרגו בתקיפות מהבוקר, בהם בני משפחתו של מנהל בית החולים שיפא","מקורות רפואיים מסרו כי מרבית ההרוגים מתו מהפצצות בעיר עזה, בהם יותר מעשרה קרובי משפחה. משרד ההסברה ברצועה דיווח שכ־22,000 תושבים שעזבו את העיר עזה חזרו אליה בשל מחסור בתשתיות באזור ההומניטרי במואסי",חדשות|מדיני ביטחוני,iJUsmqJBtgOXwEtm.jpg,"עקורים מהעיר עזה במחנה הפליטים נוסייראת, אתמול. צילום: AFP/EYAD BABA",haaretz,2025-09-20T14:28:12+03:00,,ג'קי חורי,haaretz,he,140217,2025-09-20T18:12:12.230101+00:00
L9JoR7tWD33DSm2k,https://www.haaretz.co.il/news/world/america/2025-09-20/ty-article/.premium/00000199-6592-daaf-a79f-edf6e87e0000,משרד ההגנה האמריקאי מחייב עיתונאים לאשר איתו מידע לפני הפרסום,"ההוראה החדשה נוגעת לכל מידע שקשור למשרד ולצבא, גם אם אינו חסוי, והפרתה עלולה להוביל לשלילת כניסת העיתונאים לפנטגון. המשרד הגביל גם את תנועת הכתבים בתוך המטה",חדשות|אמריקה,L9JoR7tWD33DSm2k.jpg,"מבנה הפנטגון, ב-2020. דובר הפנטגון נמנע לומר מדוע ההנחיות פורסמו כעת או אם הבית הלבן היה מעורב בהחלטה ליישמן. צילום: Carlos Barria/רויטרס",haaretz,2025-09-20T13:00:51+03:00,,ניו יורק טיימס,haaretz,he,147128,2025-09-20T12:16:45.817882+00:00
XMPoc_FqCHJInoN5,https://www.haaretz.co.il/news/picoftheday/2025-09-20/ty-article-magazine/00000199-6604-dc39-abbf-6e6419610000,"תמונות השבוע של צלמי ""הארץ""",הארץ,חדשות|תמונות השבוע,XMPoc_FqCHJInoN5.jpg,תקיפה ברצועת עזה. צילום: אילן אסייג,haaretz,2025-09-20T11:56:16+03:00,,רמי שלוש,haaretz,he,109480,2025-09-20T09:03:48.543791+00:00
vGVdtGoReHHmrsEX,https://www.haaretz.co.il/sport/world-soccer/2025-09-20/ty-article-magazine/.premium/00000199-5e6c-d45d-a3bf-ff6f67620000,"ענני השואה כבר החלו להתאסף, והם היו אימפריה יהודית גאה. הכח וינה חוגגת מאה שנה לאליפות","ערב חגיגי בווינה ציין את האליפות של הקבוצה היהודית הגדולה מכולן, הכח וינה, שחגגה 100 שנה לתואר ההוא. כיום אין לה קבוצת כדורגל, אבל היא עדיין מועדון מצליח בתחומי ספורט אחרים, ומשמרת זיכרון מעולם ישן שכבר איננו",ספורט|כדורגל בעולם,vGVdtGoReHHmrsEX.jpg,"גביע האליפות וצלחת האליפות של הכח וינה, שהוצגו בערב לציון 100 שנים לזכייה. צילום: Katharina Schiffl",haaretz,2025-09-20T11:30:27+03:00,,רונן דורפן,haaretz,he,131920,2025-09-20T09:03:48.543879+00:00
pYVDB-LMbpkLWTMc,https://www.haaretz.co.il/gallery/music/classicalmusic/classicalmusic-review/2025-09-20/ty-article/.premium/00000199-6609-dc39-abbf-6e6934a40000,"ערב עוצמתי עם דודמל, המנצח החדש של הפילהרמונית ניו יורק","ניו יורק חיכתה לגוסטבו דודמל, הציפיות היו בשמים, ובקונצרט אמש, עם יצירות בטהובן וקוריליאנו, הוא ענה עליהן",תרבות|ביקורת מוזיקה קלאסית,pYVDB-LMbpkLWTMc.jpg,"גוסטבו דודמל עם הפילהרמונית של ניו יורק, אמש. בלי להבליט את עצמו. צילום: רונצ'ו",haaretz,2025-09-20T10:44:00+03:00,,עידו תמרי,haaretz,he,tamari,2025-09-20T09:03:48.543920+00:00
VQmfgQ0DPrpZmk9g,https://www.haaretz.co.il/sport/news/2025-09-20/ty-article-live/00000199-65a0-d74c-a5db-6fbf0cd50000,"חדשות ספורט, 19 בספטמבר",ספורטאים מרוסיה ובלארוס יתחרו תחת דגל ניטרלי גם באולימפיאדת החורף 2026,ספורט|חדשות ספורט,,,haaretz,2025-09-20T08:40:47+03:00,,"כתבי ""ספורט הארץ""",haaretz,he,,2025-09-20T06:13:19.861655+00:00
