article_id,guid,title,description,category,image,image_caption,image_credit,pub_date,tags,author,source,language,image_name,fetching_time
iW1Q0Jkw3T4ZCgTM,https://www.ynet.co.il/news/article/sjsf00ptoeg,"גנץ מתרחק משותפיו - ויוצא נגד ה""גושים"": ""לא ניתן להתבסס על 'רק לא ביבי'""","בצל הניסיון באופוזיציה להתגבש לכדי אלטרנטיבה שלטונית לנתניהו, גנץ קרא באסיפה הכללית של מפלגתו ""לעבור מרל""ב לרל""ק: רק לא קיצוניים"". יו""ר המחנה הממלכתי תקף: ""חזרנו ל-6 באוקטובר על סטרואידים. אסטרטגיית הגושים חוסמת את ישראל וטובה רק לקיצוניים, שעברו מהשוליים לניהול המדינה""",חדשות|פוליטי מדיני|המערכת הפוליטית,iW1Q0Jkw3T4ZCgTM.jpg,בני גנץ,צילום: אלכס קולומויסקי,2025-09-18T22:43:53+03:00,בני גנץ|בנימין נתניהו|המחנה הממלכתי|חרבות ברזל,מורן אזולאי,ynet,he,S1UuE11dKjll_305_482_2588_1457_0_medium,2025-09-19T03:03:16.308285+00:00
jVgC1DT1maw5o1Vh,https://www.ynet.co.il/news/article/r1k11bayslx,"העדויות, התיעודים והבהלה באילת: ""שמענו רעש, לא ידענו שזה כל כך קרוב""","ליד מוקד פגיעת הכטב""ם באילת התארחו שי וליאור במלון, וסיפרו על ""ריח שרוף"" ועשן שהיתמר במקום. ראש העיר אלי לנקרי אמר כי ""יש להסיר את האיום החות'י"" - וזמן לא רב לאחר מכן טיל ששוגר מתימן הכניס מיליונים במרכז למרחבים מוגנים",חדשות|חדשות בארץ|כללי,jVgC1DT1maw5o1Vh.gif,"נפילת כטב""ם באילת",צילום: שימוש לפי סעיף 27א בחוק זכויות יוצרים,2025-09-18T22:02:48+03:00,"תימן|חות'ים|אילת|וידאו|כטב""מ|חרבות ברזל",אילנה קוריאל,ynet,he,r1JgAhtigg_0_0_587_331_0_medium,2025-09-19T03:03:16.308315+00:00
voEtJP1iI-PGcQPm,https://www.ynet.co.il/news/article/hkhwa6ksle,"צה""ל תקף מטרות חיזבאללה, נשיא לבנון גינה: ""לשים סוף להפרות הריבונות שלנו""","בשורת יישובים בדרום לבנון תקף צה""ל מחסנים של כוח רדואן, אחרי שהמתין 3 שעות שהתושבים יתפנו. לפי הצבא, ""אמצעי הלחימה שהותקפו הפרו את ההבנות בין ישראל ללבנון"". צבא לבנון טען להרוגים ופצועים, חיזבאללה: ""עמנו לא יכנע""",חדשות|פוליטי מדיני|צבא וביטחון,voEtJP1iI-PGcQPm.jpg,תקיפות בדרום לבנון,ynet,2025-09-18T21:54:10+03:00,"חיזבאללה|צה""ל|לבנון|חרבות ברזל",יואב זיתון|ליאור בן ארי,ynet,he,H1G6qRpYjee_0_0_1280_720_0_medium,2025-09-19T03:03:16.308345+00:00
_iePDK6i87Ds0Uc5,https://www.ynet.co.il/news/article/hkdwr2yogg,"השחיקה בתמיכה בארה""ב, בשער המגזין היוקרתי: ""כבר לא מתאהבים בישראל""","בצל התארכות המלחמה בעזה, ה""אקונומיסט"" הבריטי - שהביע ביקורת על ישראל לא אחת - מתאר בסדרת כתבות נרחבות כי הציבור האמריקני מתרחק מישראל, כשהמערכת הפוליטית כבר משקפת זאת. זו הסכנה שמדגיש המגזין בצל פקיעת הסכם הסיוע הצבאי ב-2028 - והניסיון של ישראל להתחבב על הנשיא טראמפ",חדשות|פוליטי מדיני|מדיני,_iePDK6i87Ds0Uc5.jpg,שער האקונומיסט,ynet,2025-09-18T21:44:55+03:00,ישראל|ארצות הברית|שער|מגזין|עיתון|חרבות ברזל,"דניאל אדלסון, ניו יורק",ynet,he,S1VSr6Koxl_0_720_1181_665_0_medium,2025-09-19T03:03:16.308375+00:00
yM5ABN1fD85dBGh0,https://www.ynet.co.il/news/article/hkqkbwkilg,"ארה""ב מנסה להחיות את המו""מ - ובכיר חמאס נוסף נצפה לראשונה מאז התקיפה בדוחא","בישראל אומרים כי עתיד המו""מ על החטופים ""בידי ארה""ב"", בצל אי-האמון של חמאס בישראל ובאמריקנים לאחר ניסיון החיסול בדוחא - שלפי הערכות זעזע את ארגון הטרור. למרות הצהרותיה, קטאר נכונה להמשיך כמתווכת: ""בלי מו""מ אין להם זכות קיום"". באסם נעים התראיין לאל-ג'זירה, אך רוב הבכירים טרם נצפו",חדשות|פוליטי מדיני|מדיני,yM5ABN1fD85dBGh0.jpg,"המבנה שהותקף בדוחא, קטאר",צילום:  REUTERS/Ibraheem Abu Mustafa,2025-09-18T21:36:47+03:00,חמאס|קטאר|ארצות הברית|חטופים|מבצע פסגת האש,איתמר אייכנר|עינב חלבי,ynet,he,H1Mu736qlx_0_323_1972_1111_0_medium,2025-09-19T03:03:16.308405+00:00
QXOWnb1znpDZijiX,https://www.ynet.co.il/news/article/rj2jtpkoge,"בן 68, לצד בן 20: סא""ל במיל' יצחק הרוש וסמל אורן הרשקו נפלו בפיגוע במעבר אלנבי","סגן-אלוף הרוש שירת במינהל האזרחי והיה אחראי על בדיקת המשאיות שמועברות מירדן לעזה - ונפל בפיגוע סמוך למקום שבו שהה בנו, שמשרת אף הוא במילואים. המחבל הירדני שנהג במשאית ירד ממנה, פתח באש ודקר אותו ואת סמל הרשקו מחטיבת תבל. בעקבות הפיגוע: הופסקה הזרמת הסיוע מירדן",חדשות|פוליטי מדיני|צבא וביטחון,QXOWnb1znpDZijiX.jpg,"סמל אורן הרשקו ז""ל וסא""ל (במיל-סמל אורן הרשקו ז""ל, סא""ל (במיל","צילום: דובר צה""ל",2025-09-18T21:02:26+03:00,ירדן|פיגוע ירי|ירי|פיגוע|גשר אלנבי,יואב זיתון|איתן גליקמן,ynet,he,BJGwYTtixx_0_0_850_479_0_medium,2025-09-19T03:03:16.308438+00:00
RYBAzoEqamo2KhDe,https://www.ynet.co.il/news/article/s1ckgakseg,"אחרי פגיעת הכטב""ם במלון באילת: טיל מתימן יורט, מיליונים נכנסו לממ""ד","טיל ששוגר מתימן ויורט הכניס מיליונים למרחבים המוגנים, לאחר שהפעיל אזעקות בין היתר בירושלים, תל אביב, רמת גן, פתח תקווה, מודיעין ורמת השרון. מד""א: לא התקבלו קריאות על נפגעים",חדשות|פוליטי מדיני|צבא וביטחון,RYBAzoEqamo2KhDe.jpg,שיגור טיל מתימן,צילום: קובי קואנקס,2025-09-18T20:30:12+03:00,תימן|חות'ים|טילים|חרבות ברזל,יואב זיתון|רענן בן צור,ynet,he,B1EDmatsxl_0_0_1280_720_0_medium,2025-09-19T03:03:16.308473+00:00
