article_id,guid,title,description,category,image,image_caption,image_credit,pub_date,tags,author,source,language,image_name,fetching_time
ttrIfnGQCFoGBc61,https://www.ynet.co.il/news/article/rj115sgojxe,השהיית הסכמי הסחר עם ישראל עברה משוכה ראשונה - ואירופה עוברת לשלב המכריע,"מועצת הנציבים באיחוד האירופי אישרה את ההצעה, שזקוקה כעת לרוב מיוחס של ראשי המדינות. ""המטרה לא להעניש את ישראל, אלא לשפר את המצב ההומניטרי בעזה"", אמרה שרת החוץ של האיחוד. במקביל, הדיונים עסקו גם בסנקציות על סמוטריץ' ובן גביר. וגם: אלה הסיבות המרכזיות שהובילו לדיון המכריע במועצה",חדשות|פוליטי מדיני|מדיני,ttrIfnGQCFoGBc61.jpg,,ynet,2025-09-18T00:50:39.026244,"האיחוד האירופי , סנקציות , איתמר בן גביר , בצלאל סמוטריץ' , חרבות ברזל",,ynet,he,5345289_0_0_1300_869_0_medium,2025-09-17T21:50:39.026244+00:00
g2zj7vIQ7fbWtjQ5,https://www.ynet.co.il/news/article/r100s6b00sel,זוכתה ירדן מן שהואשמה בתקיפת השרה סילמן,"בית המשפט זיכה את מן מכל העבירות שבהן הואשמה, ומתח ביקורת על המשטרה. ""הגברת סילמן התקשתה למסור גרסה סבירה"", קבעה השופטת על השרה. היא גם הזכירה סתירות בעדויות בתיק, וכתבה על התקרית: ""תגובה מתוך רפלקס"". סילמן: ""אילו רק הייתי שופטת שנזרקה עליה נעל""",חדשות|חדשות בארץ|משפט ופלילים,g2zj7vIQ7fbWtjQ5.jpg,ירדן מן והשרה להגנת הסביבה עידית סילמן-ירדן מן עידית סילמן,ynet,2025-09-18T00:50:39.026244,"משפט , תקיפה , עידית סילמן",,ynet,he,H1aHLMuseg_0_0_850_479_0_medium,2025-09-17T21:50:39.026244+00:00
Vx_Mzpkhh-V2WVlt,https://www.ynet.co.il/news/article/by04kwojlg,"בכירה באמ""ן: מעריכים שקטאר רוצה לחזור לתווך; בעיר עזה מחכים 7,500 מחבלים","פרסום ראשון: סגנית ראש חטיבת המחקר ונציג המל""ל אמרו בסקירה חסויה לח""כים כי עד 6/10 יושלם רק כיתור העיר עזה ופינוי אוכלוסייתה, ולא כיבוש מלא: ""חמאס נערך למשך זמן של לחימה"". לדבריה, דוחא עדיין רוצה לתווך בין ישראל לחמאס, וגם מצרים וטורקיה. אלא שמו""מ עדיין לא מתקיים",חדשות|פוליטי מדיני|מדיני,Vx_Mzpkhh-V2WVlt.jpg,שכונת שג,ynet,2025-09-18T00:50:39.024231,"עזה , קטאר , רצועת עזה , משא ומתן , אמ""ן , חרבות ברזל , עסקת חטופים , מרכבות גדעון ב'",,ynet,he,HkOJzFAR1g_0_0_850_479_0_medium,2025-09-17T21:50:39.024231+00:00
1aBXBjSyUk84Je3o,https://www.ynet.co.il/news/article/ryki9tuoge,דיווח דרמטי: בריטניה תכיר במדינה פלסטינית בסוף השבוע,"לפי ""הטיימס"" הבריטי, ראש ממשלת בריטניה קיר סטרמר יכריז על החלטתו רק אחרי שטראמפ יעזוב את המדינה - כדי שהנושא ""לא ישתלט על מסיבת העיתונאים שיכנסו"". המהלך עשוי לעודד מדינות נוספות לחבור אל היוזמה הצרפתית בעצרת האו""ם המתקרבת",חדשות|פוליטי מדיני|מדיני,1aBXBjSyUk84Je3o.jpg,"ראש ממשלת בריטניה קיר סטרמר: אם ישראל לא תפעל לסיום ""המצב המחריד"" בעזה - נכיר במדינה פלסטינית",ynet,2025-09-18T00:50:39.024231,"בריטניה , מדינה פלסטינית , קיר סטרמר",,ynet,he,rJgA0tO8Plx_0_108_3000_1689_0_medium,2025-09-17T21:50:39.024231+00:00
A3h_zLtDSUV66_22,https://www.ynet.co.il/news/article/bjbcucuolx,נשיא סוריה: בימים הקרובים עשוי להיחתם הסכם עם ישראל | תאריך היעד וכל הפרטים,"לדברי אחמד א-שרע, בקרוב צפוי להיחתם הסכם ביטחוני ש""עשוי להביא בעתיד גם להסכמות נוספות, אבל שלום ונורמליזציה כרגע לא על הפרק"". דיווח: החתימה צפויה בעצרת האו""ם, טראמפ לוחץ לקיים פסגה משולשת עם נתניהו וא-שרע",חדשות|פוליטי מדיני|מדיני,A3h_zLtDSUV66_22.jpg,חצי חצי דגלי ישראל במחאות דרוזים ב סוריה והנשיא הסורי אחמד א-שרע,ynet,2025-09-18T00:50:39.024231,"סוריה , ישראל , אחמד א-שרע",,ynet,he,rJbv2zJKll_0_0_850_479_0_medium,2025-09-17T21:50:39.024231+00:00
